### ISSUE TITLE
ssh_banner module is not working

### ISSUE THREAD

**Issue by tailriver** [prometheus/blackbox_exporter#203]
### Host operating system: output of `uname -a`
Ubuntu 16.04.2 LTS
`Linux pc-010-242 4.4.0-87-generic #110-Ubuntu SMP Tue Jul 18 12:55:35 UTC 2017 x86_64 x86_64 x86_64 GNU/Linux`

### blackbox_exporter version: output of `blackbox_exporter -version`
Using latest Dockernized version.
```
blackbox_exporter, version 0.7.0 (branch: master, revision: 9b67dd9b488160bb656cf130718b2aa62a7f30e6)
  build user:       root@756261f4b8ec
  build date:       20170714-14:40:00
  go version:       go1.8.3
```

### What is the blackbox.yml module config.
Use default in the image.

### What is the prometheus.yml scrape config.
n/a

### What logging output did you get from the `blackbox_exporter`?
See below.

#### Server side
```
$ docker run --cap-add ALL --network host --rm -it prom/blackbox-exporter -config.file=/etc/blackbox_exporter/config.yml -log.level=debug
INFO[0000] Starting blackbox_exporter (version=0.7.0, branch=master, revision=9b67dd9b488160bb656cf130718b2aa62a7f30e6)  source="main.go:153"
INFO[0000] Build context (go=go1.8.3, user=root@756261f4b8ec, date=20170714-14:40:00)  source="main.go:154"
INFO[0000] Loaded config file                            source="main.go:71"
INFO[0000] Listening on :9115                            source="main.go:226"
DEBU[0003] Processing query response entry {Expect:^SSH-2.0- Send: XXX:map[]}  source="tcp.go:98"
```
I know `--cap-add ALL` is not required, it was added to eliminate capability-related issue.

#### Client side
HELP and TYPE lines are omitted.

```
# sshd is working and the response is valid.
$ telnet 127.0.0.1 22
Trying 127.0.0.1...
Connected to localhost.
Escape character is '^]'.
SSH-2.0-OpenSSH_7.2p2 Ubuntu-4ubuntu2.2

# However, probe_success returns 0.
$ curl 'http://localhost:9115/probe?module=ssh_banner&target=127.0.0.1:22'
probe_dns_lookup_time_seconds 1.17e-07
probe_duration_seconds 0.000477857
probe_failed_due_to_regex 0
probe_ip_protocol 4
probe_success 0

# It also occurs on IPv6.
$ telnet ::1 22
(snip)
$ curl 'http://localhost:9115/probe?module=ssh_banner&target=localhost:22'
(snip)
probe_ip_protocol 6
probe_success 0

# Note: tcp_connect module is working.
$ curl 'http://localhost:9115/probe?module=tcp_connect&target=127.0.0.1:22'
probe_dns_lookup_time_seconds 1.06e-07
probe_duration_seconds 0.000271281
probe_failed_due_to_regex 0
probe_ip_protocol 4
probe_success 1
```

It also reproduced against other sshd including CentOS 6/7, Amazon Linux and CoreOS.

### What did you expect to see?
probe_success should be 1.

### What did you see instead?
probe_success got 0.

**Comment by brian-brazil** [comment]
What does tcpdump show?

**Comment by tailriver** [comment]
Please let me know if information is missing. I don't familiar with tcpdump.

Query: `curl 'http://localhost:9115/probe?module=ssh_banner&target=127.0.0.1:22'`
```
$ sudo tcpdump -v -i lo -w dump.txt
tcpdump: listening on lo, link-type EN10MB (Ethernet), capture size 262144 bytes
^C
17 packets captured
34 packets received by filter
0 packets dropped by kernel
$ sudo tcpdump -r dump.txt 
reading from file dump.txt, link-type EN10MB (Ethernet)
18:09:46.985156 IP localhost.43494 > localhost.9115: Flags [S], seq 1494900850, win 43690, options [mss 65495,sackOK,TS val 89199898 ecr 0,nop,wscale 7], length 0
18:09:46.985178 IP localhost.9115 > localhost.43494: Flags [S.], seq 3354607878, ack 1494900851, win 43690, options [mss 65495,sackOK,TS val 89199898 ecr 89199898,nop,wscale 7], length 0
18:09:46.985196 IP localhost.43494 > localhost.9115: Flags [.], ack 1, win 342, options [nop,nop,TS val 89199898 ecr 89199898], length 0
18:09:46.985252 IP localhost.43494 > localhost.9115: Flags [P.], seq 1:122, ack 1, win 342, options [nop,nop,TS val 89199898 ecr 89199898], length 121
18:09:46.985260 IP localhost.9115 > localhost.43494: Flags [.], ack 122, win 342, options [nop,nop,TS val 89199898 ecr 89199898], length 0
18:09:46.985701 IP localhost.42830 > localhost.ssh: Flags [S], seq 1446315650, win 43690, options [mss 65495,sackOK,TS val 89199898 ecr 0,nop,wscale 7], length 0
18:09:46.985719 IP localhost.ssh > localhost.42830: Flags [S.], seq 1875617516, ack 1446315651, win 43690, options [mss 65495,sackOK,TS val 89199898 ecr 89199898,nop,wscale 7], length 0
18:09:46.985733 IP localhost.42830 > localhost.ssh: Flags [.], ack 1, win 342, options [nop,nop,TS val 89199898 ecr 89199898], length 0
18:09:46.985919 IP localhost.42830 > localhost.ssh: Flags [F.], seq 1, ack 1, win 342, options [nop,nop,TS val 89199898 ecr 89199898], length 0
18:09:46.986167 IP localhost.9115 > localhost.43494: Flags [P.], seq 1:825, ack 122, win 342, options [nop,nop,TS val 89199898 ecr 89199898], length 824
18:09:46.986179 IP localhost.43494 > localhost.9115: Flags [.], ack 825, win 355, options [nop,nop,TS val 89199898 ecr 89199898], length 0
18:09:46.986288 IP localhost.43494 > localhost.9115: Flags [F.], seq 122, ack 825, win 355, options [nop,nop,TS val 89199898 ecr 89199898], length 0
18:09:46.986357 IP localhost.9115 > localhost.43494: Flags [F.], seq 825, ack 123, win 342, options [nop,nop,TS val 89199898 ecr 89199898], length 0
18:09:46.986375 IP localhost.43494 > localhost.9115: Flags [.], ack 826, win 355, options [nop,nop,TS val 89199898 ecr 89199898], length 0
18:09:46.986547 IP localhost.ssh > localhost.42830: Flags [.], ack 2, win 342, options [nop,nop,TS val 89199899 ecr 89199898], length 0
18:09:46.994116 IP localhost.ssh > localhost.42830: Flags [P.], seq 1:42, ack 2, win 342, options [nop,nop,TS val 89199900 ecr 89199898], length 41
18:09:46.994137 IP localhost.42830 > localhost.ssh: Flags [R], seq 1446315652, win 0, length 0
```

**Comment by tailriver** [comment]
It may show

- 18:09:46.985252: cURL -> Blackbox: HTTP request
- 18:09:46.986167: blackbox -> cURL: HTTP response
- 18:09:46.994116: SSH greeting message (SSH-2.0-...)

**Comment by brian-brazil** [comment]
What do the blackbox logs show?

**Comment by tailriver** [comment]
The last line responces for tcpdump'ed execution.

```
$ docker logs -t laughing_allen
2017-08-04T08:46:45.924800131Z INFO[0000] Starting blackbox_exporter (version=0.7.0, branch=master, revision=9b67dd9b488160bb656cf130718b2aa62a7f30e6)  source="main.go:153"
2017-08-04T08:46:45.924863607Z INFO[0000] Build context (go=go1.8.3, user=root@756261f4b8ec, date=20170714-14:40:00)  source="main.go:154"
2017-08-04T08:46:45.925360243Z INFO[0000] Loaded config file                            source="main.go:71"
2017-08-04T08:46:45.925524430Z INFO[0000] Listening on :9115                            source="main.go:226"
2017-08-04T08:48:37.009491243Z DEBU[0111] Processing query response entry {Expect:^SSH-2.0- Send: XXX:map[]}  source="tcp.go:98"
2017-08-04T08:48:50.416969632Z DEBU[0124] Processing query response entry {Expect:^SSH-2.0- Send: XXX:map[]}  source="tcp.go:98"
2017-08-04T08:49:02.668947273Z DEBU[0136] Processing query response entry {Expect:^SSH-2.0- Send: XXX:map[]}  source="tcp.go:98"
2017-08-04T08:52:17.622070780Z DEBU[0331] Processing query response entry {Expect:^SSH-2.0- Send: XXX:map[]}  source="tcp.go:98"
2017-08-04T08:52:36.543402514Z DEBU[0350] Processing query response entry {Expect:^SSH-2.0- Send: XXX:map[]}  source="tcp.go:98"
2017-08-04T08:52:55.870762027Z DEBU[0369] Processing query response entry {Expect:^SSH-2.0- Send: XXX:map[]}  source="tcp.go:98"
2017-08-04T08:56:03.835289053Z DEBU[0557] Processing query response entry {Expect:^SSH-2.0- Send: XXX:map[]}  source="tcp.go:98"
2017-08-04T09:09:46.986085632Z DEBU[1381] Processing query response entry {Expect:^SSH-2.0- Send: XXX:map[]}  source="tcp.go:98"
```
