### ISSUE TITLE
icmp: Both A and AAAA records are queried regardless of preferred_ip_protocol/ip_protocol_fallback

### ISSUE THREAD

**Issue by yegle** [prometheus/blackbox_exporter#724]
My local DNS cache server doesn't cache results for record that doesn't exist. E.g. if a domain don't have a configured AAAA record, a DNS query to the AAAA record will not be cached. I have no idea if this is the expected behavior (The server is https://github.com/AdguardTeam/AdGuardHome FWIW).

This leads to a higher icmp probe latency for domain names that doesn't have an AAAA record.

Reading the code, it looks like the prober is always sending A/AAAA DNS queries regardless of the preferred_ip_protocol and ip_protocol_fallback by using `resolver.LookupIPAddr(...)`.

https://github.com/prometheus/blackbox_exporter/blob/998037b5b40c1de5fee348ffdea8820509d85171/prober/utils.go#L67

Would it make more sense to call `resolver.LookupIP` with the `preferred_ip_protocol`, and then make follow up DNS queries only if `ip_protocol_fallback` is true?

### Host operating system: output of `uname -a`
Linux nuc 4.19.0-9-amd64 #1 SMP Debian 4.19.118-2+deb10u1 (2020-06-07) x86_64 GNU/Linux

### blackbox_exporter version: output of `blackbox_exporter --version`
blackbox_exporter, version 0.18.0 (branch: HEAD, revision: 60c86e6ce5a1111f7958b06ae7a08222bb6ec839)
  build user:       root@53d72328d93f
  build date:       20201012-09:46:31
  go version:       go1.15.2

### What is the blackbox.yml module config.

```
modules:
  icmp:
    prober: icmp
    timeout: 60s
    icmp:
      preferred_ip_protocol: "ip4"
```

### What is the prometheus.yml scrape config.

```
- job_name: internet-ping
  metrics_path: /probe
  params:
    module: [icmp]
  static_configs:
  - targets:
    - your-dns.run
    - google.com
 ```

### What logging output did you get from adding `&debug=true` to the probe URL?

```
Logs for the probe:
ts=2020-12-21T18:01:21.831656621Z caller=main.go:304 module=icmp target=your-dns.run level=info msg="Beginning probe" probe=icmp timeout_seconds=60
ts=2020-12-21T18:01:21.831869869Z caller=icmp.go:91 module=icmp target=your-dns.run level=info msg="Resolving target address" ip_protocol=ip4
ts=2020-12-21T18:01:21.875056949Z caller=icmp.go:91 module=icmp target=your-dns.run level=info msg="Resolved target address" ip=35.247.39.128
ts=2020-12-21T18:01:21.875134792Z caller=main.go:119 module=icmp target=your-dns.run level=info msg="Creating socket"
ts=2020-12-21T18:01:21.875204367Z caller=main.go:119 module=icmp target=your-dns.run level=debug msg="Unable to do unprivileged listen on socket, will attempt privileged" err="socket: permission denied"
ts=2020-12-21T18:01:21.875373799Z caller=main.go:119 module=icmp target=your-dns.run level=info msg="Creating ICMP packet" seq=52293 id=50814
ts=2020-12-21T18:01:21.875425358Z caller=main.go:119 module=icmp target=your-dns.run level=info msg="Writing out packet"
ts=2020-12-21T18:01:21.875576684Z caller=main.go:119 module=icmp target=your-dns.run level=info msg="Waiting for reply packets"
ts=2020-12-21T18:01:21.900723776Z caller=main.go:119 module=icmp target=your-dns.run level=info msg="Found matching reply packet"
ts=2020-12-21T18:01:21.900897095Z caller=main.go:304 module=icmp target=your-dns.run level=info msg="Probe succeeded" duration_seconds=0.069158382



Metrics that would have been returned:
# HELP probe_dns_lookup_time_seconds Returns the time taken for probe dns lookup in seconds
# TYPE probe_dns_lookup_time_seconds gauge
probe_dns_lookup_time_seconds 0.043219132
# HELP probe_duration_seconds Returns how long the probe took to complete in seconds
# TYPE probe_duration_seconds gauge
probe_duration_seconds 0.069158382
# HELP probe_icmp_duration_seconds Duration of icmp request by phase
# TYPE probe_icmp_duration_seconds gauge
probe_icmp_duration_seconds{phase="resolve"} 0.043219132
probe_icmp_duration_seconds{phase="rtt"} 0.025207606
probe_icmp_duration_seconds{phase="setup"} 0.000290841
# HELP probe_icmp_reply_hop_limit Replied packet hop limit (TTL for ipv4)
# TYPE probe_icmp_reply_hop_limit gauge
probe_icmp_reply_hop_limit 57
# HELP probe_ip_addr_hash Specifies the hash of IP address. It's useful to detect if the IP address changes.
# TYPE probe_ip_addr_hash gauge
probe_ip_addr_hash 7.89474712e+08
# HELP probe_ip_protocol Specifies whether probe ip protocol is IP4 or IP6
# TYPE probe_ip_protocol gauge
probe_ip_protocol 4
# HELP probe_success Displays whether or not the probe was a success
# TYPE probe_success gauge
probe_success 1



Module configuration:
prober: icmp
timeout: 1m0s
http:
    ip_protocol_fallback: true
tcp:
    ip_protocol_fallback: true
icmp:
    preferred_ip_protocol: ip4
    ip_protocol_fallback: true
dns:
    ip_protocol_fallback: true
```

### What did you do that produced an error?

N/A (no error)

### What did you expect to see?
DNS resolve latency should be very low (using a local cached DNS server)

### What did you see instead?

DNS resolve latency is higher than expected:

probe_icmp_duration_seconds{phase="resolve"} 0.043219132

**Comment by brian-brazil** [comment]
> I have no idea if this is the expected behavior 

You can do negative caching, as long as it doesn't go over the TTL in the SOA, but there's no requirement to do so last I checked.

> Would it make more sense to call resolver.LookupIP with the preferred_ip_protocol, and then make follow up DNS queries only if ip_protocol_fallback is true?

It seems like a bit of an odd situation, but we could do that and it might even make the code a tad simpler.

**Comment by hferreira23** [comment]
I'm noticing the same behavior. The ip_fallback_protocol doesn't seem to make any difference.

My config:

```
modules:
  icmp:
    prober: icmp
    icmp:
      preferred_ip_protocol: "ip4"
      ip_protocol_fallback: false
```

**Comment by brian-brazil** [comment]
To be clear, are you saying the above is sending ipv6 ICMP queries?

**Comment by hferreira23** [comment]
DNS queries. I'm pinging a FQDN and in the name resolution process it queries both A (which resolves just fine) and AAAA (which resolves to NO DATA as I don't have a ipv6 resolver) records even though the prefered_ip_protocol and ip_protocol_fallback are setup as shown above.

I also see this behavior with the http_2xx module if it helps narrow down the issue.

**Comment by brian-brazil** [comment]
This is what this issue is about, but it's not a bug per-se. It's only promised that the icmp/http request is over the given protocol.

**Comment by ee-github** [comment]
Apologies if replying here on a closed issue is no appropriate, but did this ever make it into the builds?  I'm seeing both A and AAAA DNS query for ICMP probe targets.

blackbox_exporter_build_info{branch="master",goversion="go1.16.10",revision="70bff7941301753b125a40bcf6b3ed28935a9a94",version="0.19.0"} 1

tcpdump:
17:24:03.680670 IP 192.168.1.87.52172 > 192.168.1.1.53: 5781+ [1au] A? gw.[redacted].com. (46)
17:24:03.680784 IP 192.168.1.87.57526 > 192.168.1.1.53: 18002+ [1au] AAAA? gw.[redacted].com. (46)
17:24:03.681040 IP 192.168.1.1.53 > 192.168.1.87.52172: 5781* 1/0/1 A 192.168.1.1 (62)
17:24:03.681119 IP 192.168.1.1.53 > 192.168.1.87.57526: 18002 0/0/1 (46)

Configured in .yml as follows:

  icmp_probe:
    prober: icmp
    timeout: 5s
    icmp:
      preferred_ip_protocol: "ip4"
      ip_protocol_fallback: false

/config does not show the fallback = false under the dns: heading.  Expected?

    icmp_probe:
        prober: icmp
        timeout: 5s
        http:
            ip_protocol_fallback: true
            follow_redirects: true
        tcp:
            ip_protocol_fallback: true
        icmp:
            preferred_ip_protocol: ip4
        dns:
            ip_protocol_fallback: true

Impact:  In this environment, A records are answered locally by a forwarding resolver (network router), while AAAA are forwarded further.  During an upstream outage there is no network route to the upstream resolver and the AAAA record is thus answered as "refused", while the A record is answered just fine.  Blackbox then falsely fails the probe at the DNS step even though a valid A record was received and the target is perfectly reachable by ICMP in the un-severed part of the network.

Is my config/expectation wrong, or did I stumble on an unaddressed scenario?
