### ISSUE TITLE
Large amounts of DNS queries for http prober

### ISSUE THREAD

**Issue by jakajancar** [prometheus/blackbox_exporter#437]
I have a `http_2xx` job set up to run every 15 seconds and using tcpdump everything seems normal (see timestamps):

```
# tcpdump 'dst host ipv4.tlund.se and tcp[tcpflags] & (tcp-syn) != 0' -i any -n
tcpdump: verbose output suppressed, use -v or -vv for full protocol decode
listening on any, link-type LINUX_SLL (Linux cooked), capture size 262144 bytes
17:38:44.253677 IP 68.175.122.25.35560 > 193.15.228.195.443: Flags [S], seq 1350864483, win 29200, options [mss 1460,sackOK,TS val 1109907830 ecr 0,nop,wscale 7], length 0
17:38:59.119038 IP 68.175.122.25.35584 > 193.15.228.195.443: Flags [S], seq 3892699257, win 29200, options [mss 1460,sackOK,TS val 1109922695 ecr 0,nop,wscale 7], length 0
17:39:14.182963 IP 68.175.122.25.35608 > 193.15.228.195.443: Flags [S], seq 2776697118, win 29200, options [mss 1460,sackOK,TS val 1109937758 ecr 0,nop,wscale 7], length 0
17:39:29.176138 IP 68.175.122.25.35632 > 193.15.228.195.443: Flags [S], seq 1301610552, win 29200, options [mss 1460,sackOK,TS val 1109952751 ecr 0,nop,wscale 7], length 0
17:39:44.193675 IP 68.175.122.25.35656 > 193.15.228.195.443: Flags [S], seq 2911762182, win 29200, options [mss 1460,sackOK,TS val 1109967768 ecr 0,nop,wscale 7], length 0

```

However looking at the DNS queries, they're coming in like crazy (again, see timestamps):

```
17:40:43.975924 IP 127.0.0.1.11917 > 127.0.0.53.53: 45247+% AAAA? ipv4.tlund.se. (31)
17:40:43.976413 IP 127.0.0.1.1676 > 127.0.0.53.53: 47710+% AAAA? ipv4.tlund.se. (31)
17:40:43.976824 IP 127.0.0.1.3294 > 127.0.0.53.53: 30581+% AAAA? ipv4.tlund.se. (31)
17:40:43.977364 IP 127.0.0.1.42246 > 127.0.0.53.53: 34223+% AAAA? ipv4.tlund.se. (31)
17:40:44.044118 IP 127.0.0.1.3294 > 127.0.0.53.53: 39766+% A? ipv4.tlund.se. (31)
17:40:44.152330 IP 127.0.0.1.9506 > 127.0.0.53.53: 41898+% A? ipv4.tlund.se. (31)
17:40:44.154261 IP 127.0.0.1.48103 > 127.0.0.53.53: 54203+% AAAA? ipv4.tlund.se. (31)
17:40:44.154839 IP 127.0.0.1.50677 > 127.0.0.53.53: 38003+% AAAA? ipv4.tlund.se. (31)
17:40:44.155302 IP 127.0.0.1.31902 > 127.0.0.53.53: 215+% AAAA? ipv4.tlund.se. (31)
17:40:44.155735 IP 127.0.0.1.3294 > 127.0.0.53.53: 18802+% AAAA? ipv4.tlund.se. (31)
17:40:44.156213 IP 127.0.0.1.3294 > 127.0.0.53.53: 44985+% AAAA? ipv4.tlund.se. (31)
17:40:44.157212 IP 127.0.0.1.3294 > 127.0.0.53.53: 22834+% AAAA? ipv4.tlund.se. (31)
17:40:44.157621 IP 127.0.0.1.59115 > 127.0.0.53.53: 56341+% AAAA? ipv4.tlund.se. (31)
17:40:44.158336 IP 127.0.0.1.2676 > 127.0.0.53.53: 4348+% AAAA? ipv4.tlund.se. (31)
17:40:44.158778 IP 127.0.0.1.54640 > 127.0.0.53.53: 60971+% AAAA? ipv4.tlund.se. (31)
17:40:44.228636 IP 127.0.0.1.60267 > 127.0.0.53.53: 30982+% A? ipv4.tlund.se. (31)
17:40:44.295164 IP 127.0.0.1.48843 > 127.0.0.53.53: 24273+% A? ipv4.tlund.se. (31)
17:40:44.296219 IP 127.0.0.1.53715 > 127.0.0.53.53: 16740+% AAAA? ipv4.tlund.se. (31)
17:40:44.336624 IP 127.0.0.1.3294 > 127.0.0.53.53: 20617+% A? ipv4.tlund.se. (31)
17:40:44.338562 IP 127.0.0.1.20582 > 127.0.0.53.53: 29488+% AAAA? ipv4.tlund.se. (31)
17:40:44.339002 IP 127.0.0.1.3294 > 127.0.0.53.53: 41823+% AAAA? ipv4.tlund.se. (31)
17:40:44.339675 IP 127.0.0.1.52702 > 127.0.0.53.53: 23020+% AAAA? ipv4.tlund.se. (31)
17:40:44.340138 IP 127.0.0.1.17517 > 127.0.0.53.53: 16116+% AAAA? ipv4.tlund.se. (31)
17:40:44.340595 IP 127.0.0.1.45696 > 127.0.0.53.53: 13734+% AAAA? ipv4.tlund.se. (31)
17:40:44.341540 IP 127.0.0.1.14990 > 127.0.0.53.53: 12503+% AAAA? ipv4.tlund.se. (31)
17:40:44.342143 IP 127.0.0.1.11449 > 127.0.0.53.53: 8916+% AAAA? ipv4.tlund.se. (31)
17:40:44.342592 IP 127.0.0.1.3294 > 127.0.0.53.53: 14018+% AAAA? ipv4.tlund.se. (31)
17:40:44.343086 IP 127.0.0.1.3294 > 127.0.0.53.53: 7647+% AAAA? ipv4.tlund.se. (31)
17:40:44.410384 IP 127.0.0.1.3294 > 127.0.0.53.53: 55000+% A? ipv4.tlund.se. (31)
17:40:44.477940 IP 127.0.0.1.3294 > 127.0.0.53.53: 65282+% A? ipv4.tlund.se. (31)
17:40:44.478520 IP 127.0.0.1.3294 > 127.0.0.53.53: 16024+% A? ipv4.tlund.se. (31)
17:40:44.480086 IP 127.0.0.1.3294 > 127.0.0.53.53: 1857+% AAAA? ipv4.tlund.se. (31)
17:40:44.480146 IP 127.0.0.1.3294 > 127.0.0.53.53: 46194+% AAAA? ipv4.tlund.se. (31)
17:40:44.519298 IP 127.0.0.1.3294 > 127.0.0.53.53: 10070+% A? ipv4.tlund.se. (31)
17:40:44.520423 IP 127.0.0.1.23093 > 127.0.0.53.53: 53492+% AAAA? ipv4.tlund.se. (31)
17:40:44.521067 IP 127.0.0.1.28684 > 127.0.0.53.53: 11146+% AAAA? ipv4.tlund.se. (31)
17:40:44.521306 IP 127.0.0.1.62812 > 127.0.0.53.53: 59166+% AAAA? ipv4.tlund.se. (31)
17:40:44.522133 IP 127.0.0.1.3755 > 127.0.0.53.53: 18020+% AAAA? ipv4.tlund.se. (31)
17:40:44.522882 IP 127.0.0.1.3294 > 127.0.0.53.53: 18212+% AAAA? ipv4.tlund.se. (31)
17:40:44.523220 IP 127.0.0.1.3294 > 127.0.0.53.53: 7697+% AAAA? ipv4.tlund.se. (31)
17:40:44.523855 IP 127.0.0.1.13014 > 127.0.0.53.53: 26567+% AAAA? ipv4.tlund.se. (31)
17:40:44.524306 IP 127.0.0.1.9960 > 127.0.0.53.53: 44987+% AAAA? ipv4.tlund.se. (31)
17:40:44.592409 IP 127.0.0.1.3294 > 127.0.0.53.53: 13361+% A? ipv4.tlund.se. (31)
```

This is practically going on non stop. Many many per second:

```
     66 17:41:26
     76 17:41:27
     71 17:41:28
     93 17:41:29
    151 17:41:30
    184 17:41:31
    216 17:41:32
    206 17:41:33
    227 17:41:34
    221 17:41:35
    190 17:41:36
    113 17:41:37
    103 17:41:38
     66 17:41:39
     43 17:41:40
     38 17:41:41
     19 17:41:42
     12 17:41:43
     36 17:41:44
     71 17:41:45
    110 17:41:46
    120 17:41:47
    135 17:41:48
    150 17:41:49
    195 17:41:50
    170 17:41:51
```


Result is crazy CPU usage:
```
  PID USER      PR  NI    VIRT    RES    SHR S  %CPU  %MEM     TIME+ COMMAND                                                                                                                                                                                                                                                                   
29409 systemd+  20   0   42604  22756   6388 R  99.3   0.3 243:21.92 systemd-resolve                                                                                                                                                                                                                                                           
23889 dnsmasq   20   0   18012   2532   2184 S  48.2   0.0  12:19.32 dnsmasq                                                                                                                                                                                                                                                                   
```

How do I go about debugging this?

**Comment by jakajancar** [comment]
Beh, feel free to close, looks like some dns resolution loop on my side :/
