### ISSUE TITLE
Blackbox exporter sometimes doesn't pickup responses

### ISSUE THREAD

**Issue by starcry** [prometheus/blackbox_exporter#512]
type: bug report

Hello,

A few times a day we get false positives alerting saying that a probe has exceeded the time limit. I launched an ubuntu container into the same pod as the blackbox exporter and ran a tcpdump. There was a 2 second difference the tme system clocks but I saw the responses coming in for our requests however blackbox wasn't picking them up. I've put in all the details below.

Thanks
Aidan

### Host operating system: output of `uname -a`
Linux blackbox-exporter 4.14.127+ #1 SMP Tue Jun 18 18:32:10 PDT 2019 x86_64 GNU/Linux

### blackbox_exporter version: output of `blackbox_exporter -version`

  build user:       root@63d11aa5b6c6
  build date:       20190315-13:32:31
  go version:       go1.11.5

### What is the blackbox.yml module config.
modules:
  http_2xx:
    prober: http
    http:
      preferred_ip_protocol: "ip4"
  http_post_2xx:
    prober: http
    http:
      method: POST
      preferred_ip_protocol: "ip4"
  tcp_connect:
    prober: tcp
    tcp:
      preferred_ip_protocol: "ip4"
  pop3s_banner:
    prober: tcp
    tcp:
      preferred_ip_protocol: "ip4"
      query_response:
      - expect: "^+OK"
      tls: true
      tls_config:
        insecure_skip_verify: false
  ssh_banner:
    prober: tcp
    tcp:
      preferred_ip_protocol: "ip4"
      query_response:
      - expect: "^SSH-2.0-"
  irc_banner:
    prober: tcp
    tcp:
      preferred_ip_protocol: "ip4"
      query_response:
      - send: "NICK prober"
      - send: "USER prober prober prober :prober"
      - expect: "PING :([^ ]+)"
        send: "PONG ${1}"
      - expect: "^:[^ ]+ 001"
  icmp:
    prober: icmp
    icmp:
      preferred_ip_protocol: "ip4"

### What is the prometheus.yml scrape config.
<......>
- job_name: external-monitoring
  scrape_interval: 60s
  scrape_timeout: 20s
  metrics_path: /probe
  params:
    module:
    - http_2xx
  static_configs:
  - targets:
    - ..........
    - ..........
    - ..........
    - ..........
    - ..........
    - ..........
    - ..........
    - ..........
    - ..........
    labels:
      stack: production
      product_group: web
      team: development
      tier: web-server
  relabel_configs:
  - source_labels:
    - __address__
    regex: (.*)(:443)?
    target_label: __param_target
    replacement: ${1}
  - source_labels:
    - __param_target
    regex: (.*)
    target_label: instance
    replacement: ${1}
  - source_labels: []
    regex: .*
    target_label: __address__
    replacement: blackbox-exporter:9115
<......>

### What logging output did you get from adding `&debug=true` to the probe URL?
ts=2019-08-19T11:17:59.124343425Z caller=main.go:174 module=http_2xx target=........ level=debug msg="Beginning probe" probe=http timeout_seconds=19.5
ts=2019-08-19T11:17:59.124662119Z caller=main.go:174 module=http_2xx target=........ level=debug msg="Resolving target address" ip_protocol=ip4
ts=2019-08-19T11:17:59.126283386Z caller=main.go:174 module=http_2xx target=........ level=debug msg="Resolved target address" ip=........
ts=2019-08-19T11:17:59.126613178Z caller=main.go:174 module=http_2xx target=........ level=debug msg="Making HTTP request" url=........ host=........

ts=2019-08-19T11:18:07.51732938Z caller=main.go:174 module=http_2xx target=........ level=debug msg="Beginning probe" probe=http timeout_seconds=19.5
ts=2019-08-19T11:18:07.517456993Z caller=main.go:174 module=http_2xx target=........ level=debug msg="Resolving target address" ip_protocol=ip4
ts=2019-08-19T11:18:07.519367352Z caller=main.go:174 module=http_2xx target=........ level=debug msg="Resolved target address" ip=........
ts=2019-08-19T11:18:07.519449773Z caller=main.go:174 module=http_2xx target=........ level=debug msg="Making HTTP request" url=........ host=........
ts=2019-08-19T11:18:09.33703342Z caller=main.go:174 module=http_2xx target=........ level=debug msg="Received HTTP response" status_code=200
ts=2019-08-19T11:18:10.267172156Z caller=main.go:174 module=http_2xx target=........ level=debug msg="Response timings for roundtrip" roundtrip=0 start=2019-08-19T11:18:07.519639801Z dnsDone=2019-08-19T11:18:07.519639801Z connectDone=2019-08-1
ts=2019-08-19T11:18:10.267286456Z caller=main.go:174 module=http_2xx target=........ level=debug msg="Probe succeeded" duration_seconds=2.749913164

ts=2019-08-19T11:18:18.624720106Z caller=main.go:174 module=http_2xx target=........ level=debug msg="Error for HTTP request" err="Get ........: context deadline exceeded"
ts=2019-08-19T11:18:18.624817199Z caller=main.go:174 module=http_2xx target=........ level=debug msg="Response timings for roundtrip" roundtrip=0 start=2019-08-19T11:17:59.12681216Z dnsDone=2019-08-19T11:17:59.12681216Z connectDone=2019-08-19T
ts=2019-08-19T11:18:18.624854767Z caller=main.go:174 module=http_2xx target=........ level=debug msg="Probe failed" duration_seconds=19.500389158

### What did you do that produced an error?
ran blackbox exporter in K8S

### What did you expect to see?
for blackbox to work without ignoring data

### What did you see instead?
a few times a day we get false positive report for httpd response being slow. I launched a container in the same pod and ran a tcpdump and saw responses coming in for requests made but these requests were not being picked up by the exporter.
11:17:48.771308 IP ........https > blackbox-exporter.46604: Flags [.], ack 460, win 244, options [nop,nop,TS val 2403358234 ecr 1648936184], length 0
11:17:57.134431 IP blackbox-exporter.46682 > ........https: Flags [S], seq 2214494261, win 28400, options [mss 1420,sackOK,TS val 1648944548 ecr 0,nop,wscale 7], length 0
11:17:57.135979 IP ........https > blackbox-exporter.46682: Flags [S.], seq 1078278158, ack 2214494262, win 60192, options [mss 1380,sackOK,TS val 3842129618 ecr 1648944548,nop,wscale 8], length 0
11:17:57.135997 IP blackbox-exporter.46682 > ........https: Flags [.], ack 1, win 222, options [nop,nop,TS val 1648944550 ecr 3842129618], length 0
11:17:57.137252 IP blackbox-exporter.46682 > ........https: Flags [P.], seq 1:174, ack 1, win 222, options [nop,nop,TS val 1648944551 ecr 3842129618], length 173
11:17:57.138151 IP ........https > blackbox-exporter.46682: Flags [.], ack 174, win 240, options [nop,nop,TS val 3842129621 ecr 1648944551], length 0
11:17:57.142322 IP ........https > blackbox-exporter.46682: Flags [P.], seq 1:5127, ack 174, win 240, options [nop,nop,TS val 3842129625 ecr 1648944551], length 5126
11:17:57.142349 IP blackbox-exporter.46682 > ........https: Flags [.], ack 5127, win 302, options [nop,nop,TS val 1648944556 ecr 3842129625], length 0
11:17:57.144883 IP blackbox-exporter.46682 > ........https: Flags [P.], seq 174:267, ack 5127, win 302, options [nop,nop,TS val 1648944559 ecr 3842129625], length 93
11:17:57.146964 IP ........https > blackbox-exporter.46682: Flags [P.], seq 5127:5178, ack 267, win 240, options [nop,nop,TS val 3842129629 ecr 1648944559], length 51
11:17:57.147213 IP blackbox-exporter.46682 > ........https: Flags [P.], seq 267:428, ack 5178, win 302, options [nop,nop,TS val 1648944561 ecr 3842129629], length 161
11:17:57.154623 IP ........https > blackbox-exporter.46682: Flags [P.], seq 5178:5437, ack 428, win 244, options [nop,nop,TS val 3842129637 ecr 1648944561], length 259
11:17:57.154759 IP ........https > blackbox-exporter.46682: Flags [F.], seq 5437, ack 428, win 244, options [nop,nop,TS val 3842129637 ecr 1648944561], length 0
11:17:57.155042 IP blackbox-exporter.46682 > ........https: Flags [P.], seq 428:459, ack 5438, win 324, options [nop,nop,TS val 1648944569 ecr 3842129637], length 31
11:17:57.155097 IP blackbox-exporter.46682 > ........https: Flags [F.], seq 459, ack 5438, win 324, options [nop,nop,TS val 1648944569 ecr 3842129637], length 0
11:17:57.156094 IP ........https > blackbox-exporter.46682: Flags [.], ack 460, win 244, options [nop,nop,TS val 3842129639 ecr 1648944569], length 0

**Comment by brian-brazil** [comment]
> There was a 2 second difference the tme system clocks

This shouldn't make a difference, beyond making debugging a little trickier.

It looks to me like the server terminated the connection after the TLS negotiation, so this is a true positive. Do you have more details on what's going on? This smells like a Go bug.

**Comment by starcry** [comment]
Hi Brian,
Thank you for getting back to me so quickly, what sort of details would be useful to you?

**Comment by brian-brazil** [comment]
Protocol decoding, strace from the blackbox end, and if this only happens on one machine.

**Comment by starcry** [comment]
could you clarify exactly what you mean by protocol decoding? I'd like to get you exactly what you're after. Also in answer to your question, yeah it only happens on the blackbox k8s pod, we've killed the pod many times but it keeps happening

As to the strace, here it is when we got alerted
```
epoll_ctl(4, EPOLL_CTL_DEL, 5, 0xc00068864c) = 0
close(5)                                = 0
futex(0xc000040bc0, FUTEX_WAKE_PRIVATE, 1) = 1
write(2, "ts=2019-08-20T11:09:59.132032666"..., 170) = 170
write(2, "ts=2019-08-20T11:09:59.132417666"..., 212) = 212
futex(0xc000041640, FUTEX_WAKE_PRIVATE, 1) = 1
socket(AF_INET, SOCK_STREAM|SOCK_CLOEXEC|SOCK_NONBLOCK, IPPROTO_IP) = 5
setsockopt(5, SOL_SOCKET, SO_BROADCAST, [1], 4) = 0
connect(5, {sa_family=AF_INET, sin_port=htons(443), sin_addr=inet_addr("123.456.789.12")}, 16) = -1 EINPROGRESS (Operation in progress)
epoll_ctl(4, EPOLL_CTL_ADD, 5, {EPOLLIN|EPOLLOUT|EPOLLRDHUP|EPOLLET, {u32=1986886384, u64=140430237596400}}) = 0
futex(0xeaf3c0, FUTEX_WAKE_PRIVATE, 1)  = 1
futex(0xc000041640, FUTEX_WAKE_PRIVATE, 1) = 1
futex(0xeabf40, FUTEX_WAIT_PRIVATE, 0, NULL) = 0
futex(0xeab868, FUTEX_WAKE_PRIVATE, 1)  = 1
futex(0xeabf40, FUTEX_WAIT_PRIVATE, 0, NULL) = 0
nanosleep({tv_sec=0, tv_nsec=3000}, NULL) = 0
futex(0xeabf40, FUTEX_WAIT_PRIVATE, 0, NULL) = 0
futex(0xeabf40, FUTEX_WAIT_PRIVATE, 0, NULL) = 0
epoll_pwait(4, [], 128, 0, NULL, 0)     = 0
nanosleep({tv_sec=0, tv_nsec=3000}, NULL) = 0
futex(0xc000041640, FUTEX_WAKE_PRIVATE, 1) = 1
read(11, 0xc00039aeb1, 1)               = -1 EAGAIN (Resource temporarily unavailable)
futex(0xeabf40, FUTEX_WAIT_PRIVATE, 0, NULL) = 0
futex(0xeabf40, FUTEX_WAIT_PRIVATE, 0, NULL) = -1 EAGAIN (Resource temporarily unavailable)
futex(0xc000152140, FUTEX_WAKE_PRIVATE, 1) = 1
futex(0xeaf3c0, FUTEX_WAKE_PRIVATE, 1)  = 1
futex(0xeaf3a0, FUTEX_WAKE_PRIVATE, 1)  = 1
socket(AF_INET, SOCK_DGRAM|SOCK_CLOEXEC|SOCK_NONBLOCK, IPPROTO_IP) = 12
setsockopt(12, SOL_SOCKET, SO_BROADCAST, [1], 4) = 0
connect(12, {sa_family=AF_INET, sin_port=htons(53), sin_addr=inet_addr("123.456.789.10")}, 16) = 0
epoll_ctl(4, EPOLL_CTL_ADD, 12, {EPOLLIN|EPOLLOUT|EPOLLRDHUP|EPOLLET, {u32=1986885760, u64=140430237595776}}) = 0
getsockname(12, {sa_family=AF_INET, sin_port=htons(33108), sin_addr=inet_addr("123.456.789.97")}, [112->16]) = 0
getpeername(12, {sa_family=AF_INET, sin_port=htons(53), sin_addr=inet_addr("123.456.789.10")}, [112->16]) = 0
futex(0xeaf3c0, FUTEX_WAKE_PRIVATE, 1)  = 1
futex(0xeaf3a0, FUTEX_WAKE_PRIVATE, 1)  = 1
write(12, "\235\365\1\0\0\1\0\0\0\0\0\0\3www\10......\3com\0\0\1"..., 34) = 34
read(12, 0xc000176000, 512)             = -1 EAGAIN (Resource temporarily unavailable)
futex(0xeabf40, FUTEX_WAIT_PRIVATE, 0, NULL) = 0
futex(0xeabf40, FUTEX_WAIT_PRIVATE, 0, NULL) = 0
futex(0xeabf40, FUTEX_WAIT_PRIVATE, 0, NULL) = 0
futex(0xeabf40, FUTEX_WAIT_PRIVATE, 0, NULL) = 0
futex(0xeabf40, FUTEX_WAIT_PRIVATE, 0, NULL) = 0
epoll_pwait(4, [], 128, 0, NULL, 0)     = 0
epoll_pwait(4, [{EPOLLIN|EPOLLOUT, {u32=1986886384, u64=140430237596400}}], 128, -1, NULL, 3) = 1
futex(0xeab470, FUTEX_WAKE_PRIVATE, 1)  = 1
futex(0xeab390, FUTEX_WAKE_PRIVATE, 1)  = 1
read(5, "\27\3\3@\30\f\2\216\36,\311(\355\355\272\310rM\232sE\336L\261\354\311\303I\f^\32\353"..., 8192) = 8192
read(5, "\337l{\260\323bl\323\270\370\363\376\3557:\220\"p\225\250\213\r\244\304\371'\370_\215\326\307\37"..., 24576) = 5888
read(5, 0xc0001d1700, 18688)            = -1 EAGAIN (Resource temporarily unavailable)
epoll_pwait(4, [], 128, 0, NULL, 0)     = 0
epoll_pwait(4, [{EPOLLIN|EPOLLOUT, {u32=1986886384, u64=140430237596400}}], 128, -1, NULL, 0) = 1
futex(0xeab470, FUTEX_WAKE_PRIVATE, 1)  = 1
futex(0xeab390, FUTEX_WAKE_PRIVATE, 1)  = 1
read(5, "E\355\212\213\261\252\260f\326\377j\4\232\374\33\227\231\356\304\f\323\3BC\350\226bJ*\tYb"..., 18688) = 2333
futex(0xc000040bc0, FUTEX_WAKE_PRIVATE, 1) = 1
write(2, "ts=2019-08-20T11:10:01.299998473"..., 169) = 169
read(5, 0xc0001ce000, 32768)            = -1 EAGAIN (Resource temporarily unavailable)
futex(0xeabf40, FUTEX_WAIT_PRIVATE, 0, NULL) = 0
epoll_pwait(4, [], 128, 0, NULL, 0)     = 0
epoll_pwait(4, [{EPOLLIN|EPOLLOUT, {u32=1986887008, u64=140430237597024}}], 128, -1, NULL, 3) = 1
futex(0xeab470, FUTEX_WAKE_PRIVATE, 1)  = 1
futex(0xeab390, FUTEX_WAKE_PRIVATE, 1)  = 1
read(9, "GET /probe?module=http_2xx&targe"..., 4096) = 283
futex(0xc0000f0bc0, FUTEX_WAKE_PRIVATE, 1) = 1
futex(0xc0000f04c0, FUTEX_WAKE_PRIVATE, 1) = 1
futex(0xeaf420, FUTEX_WAKE_PRIVATE, 1)  = 1
write(2, "ts=2019-08-20T11:10:03.158057933"..., 190) = 190
futex(0xc000040bc0, FUTEX_WAKE_PRIVATE, 1) = 1
write(2, "ts=2019-08-20T11:10:03.158933222"..., 183) = 183
futex(0xc000040bc0, FUTEX_WAKE_PRIVATE, 1) = 1
newfstatat(AT_FDCWD, "/etc/hosts", {st_mode=S_IFREG|0644, st_size=212, ...}, 0) = 0
newfstatat(AT_FDCWD, "/etc/resolv.conf", {st_mode=S_IFREG|0644, st_size=146, ...}, 0) = 0
futex(0xeaf440, FUTEX_WAKE_PRIVATE, 1)  = 1
socket(AF_INET, SOCK_DGRAM|SOCK_CLOEXEC|SOCK_NONBLOCK, IPPROTO_IP) = 5
setsockopt(5, SOL_SOCKET, SO_BROADCAST, [1], 4) = 0
connect(5, {sa_family=AF_INET, sin_port=htons(53), sin_addr=inet_addr("123.456.789.10")}, 16) = 0
epoll_ctl(4, EPOLL_CTL_ADD, 5, {EPOLLIN|EPOLLOUT|EPOLLRDHUP|EPOLLET, {u32=1986886384, u64=140430237596400}}) = 0
getsockname(5, {sa_family=AF_INET, sin_port=htons(47679), sin_addr=inet_addr("123.456.789.97")}, [112->16]) = 0
getpeername(5, {sa_family=AF_INET, sin_port=htons(53), sin_addr=inet_addr("123.456.789.10")}, [112->16]) = 0
futex(0xeaf440, FUTEX_WAKE_PRIVATE, 1)  = 1
futex(0xeaf420, FUTEX_WAKE_PRIVATE, 1)  = 1
write(5, "k\314\1\0\0\1\0\0\0\0\0\0\17..........\10......"..., 46) = 46
read(5, 0xc000176000, 512)              = -1 EAGAIN (Resource temporarily unavailable)
socket(AF_INET, SOCK_DGRAM|SOCK_CLOEXEC|SOCK_NONBLOCK, IPPROTO_IP) = 6
setsockopt(6, SOL_SOCKET, SO_BROADCAST, [1], 4) = 0
connect(6, {sa_family=AF_INET, sin_port=htons(53), sin_addr=inet_addr("123.456.789.10")}, 16) = 0
epoll_ctl(4, EPOLL_CTL_ADD, 6, {EPOLLIN|EPOLLOUT|EPOLLRDHUP|EPOLLET, {u32=1986886384, u64=140430237596400}}) = 0
getsockname(6, {sa_family=AF_INET, sin_port=htons(36986), sin_addr=inet_addr("123.456.789.97")}, [112->16]) = 0
getpeername(6, {sa_family=AF_INET, sin_port=htons(53), sin_addr=inet_addr("123.456.789.10")}, [112->16]) = 0
futex(0xeaf440, FUTEX_WAKE_PRIVATE, 1)  = 1
futex(0xeaf420, FUTEX_WAKE_PRIVATE, 1)  = 1
write(6, "-W\1\0\0\1\0\0\0\0\0\0\17..........\10......"..., 46) = 46
read(6, 0xc000176200, 512)              = -1 EAGAIN (Resource temporarily unavailable)
futex(0xeabf40, FUTEX_WAIT_PRIVATE, 0, NULL) = 0
futex(0xeabf40, FUTEX_WAIT_PRIVATE, 0, NULL) = 0
epoll_pwait(4, [], 128, 0, NULL, 0)     = 0
futex(0xeabf40, FUTEX_WAIT_PRIVATE, 0, NULL) = -1 EAGAIN (Resource temporarily unavailable)
futex(0xeabf40, FUTEX_WAIT_PRIVATE, 0, NULL) = 0
futex(0xc000041640, FUTEX_WAKE_PRIVATE, 1) = 1
futex(0xeaf3c0, FUTEX_WAKE_PRIVATE, 1)  = 1
futex(0xeaf3a0, FUTEX_WAKE_PRIVATE, 1)  = 1
socket(AF_INET, SOCK_DGRAM|SOCK_CLOEXEC|SOCK_NONBLOCK, IPPROTO_IP) = 6
setsockopt(6, SOL_SOCKET, SO_BROADCAST, [1], 4) = 0
connect(6, {sa_family=AF_INET, sin_port=htons(53), sin_addr=inet_addr("123.456.789.10")}, 16) = 0
epoll_ctl(4, EPOLL_CTL_ADD, 6, {EPOLLIN|EPOLLOUT|EPOLLRDHUP|EPOLLET, {u32=1986886384, u64=140430237596400}}) = 0
getsockname(6, {sa_family=AF_INET, sin_port=htons(40041), sin_addr=inet_addr("123.456.789.97")}, [112->16]) = 0
getpeername(6, {sa_family=AF_INET, sin_port=htons(53), sin_addr=inet_addr("123.456.789.10")}, [112->16]) = 0
futex(0xeaf3c0, FUTEX_WAKE_PRIVATE, 1)  = 1
futex(0xeaf3a0, FUTEX_WAKE_PRIVATE, 1)  = 1
write(6, "4t\1\0\0\1\0\0\0\0\0\0\3www\10......\3com\0\0\1"..., 34) = 34
read(6, 0xc000416400, 512)              = -1 EAGAIN (Resource temporarily unavailable)
futex(0xeabf40, FUTEX_WAIT_PRIVATE, 0, NULL) = 0
futex(0xeabf40, FUTEX_WAIT_PRIVATE, 0, NULL) = 0
futex(0xeabf40, FUTEX_WAIT_PRIVATE, 0, NULL) = 0
futex(0xeabf40, FUTEX_WAIT_PRIVATE, 0, NULL) = 0
epoll_pwait(4, [{EPOLLIN|EPOLLOUT, {u32=1986886384, u64=140430237596400}}], 128, 0, NULL, 0) = 1
futex(0xc000040bc0, FUTEX_WAKE_PRIVATE, 1) = 1
read(5, "\273\341\211`\270\214(V\254\24\35\234\n\347q\353\317\16\335=\251\226\241H\275<\367\257\265\r\"L"..., 4198) = 1524
futex(0xeab460, FUTEX_WAKE_PRIVATE, 1)  = 0
futex(0xeab390, FUTEX_WAKE_PRIVATE, 1)  = 1
sched_yield()                           = 0
futex(0xeab390, FUTEX_WAKE_PRIVATE, 1)  = 0
futex(0xeabf40, FUTEX_WAIT_PRIVATE, 0, NULL) = 0
futex(0xeab868, FUTEX_WAKE_PRIVATE, 1)  = 1
futex(0xeabf40, FUTEX_WAIT_PRIVATE, 0, NULL) = 0
futex(0xeabf40, FUTEX_WAIT_PRIVATE, 0, NULL) = 0
epoll_pwait(4, [{EPOLLOUT, {u32=1986886384, u64=140430237596400}}, {EPOLLOUT, {u32=1986885760, u64=140430237595776}}], 128, 0, NULL, 0) = 2
futex(0xeabf40, FUTEX_WAIT_PRIVATE, 0, NULL) = 0
futex(0xeabf40, FUTEX_WAIT_PRIVATE, 0, NULL) = -1 EAGAIN (Resource temporarily unavailable)
futex(0xc0000f0bc0, FUTEX_WAKE_PRIVATE, 1) = 1
futex(0xeaf3c0, FUTEX_WAKE_PRIVATE, 1)  = 1
futex(0xeaf3a0, FUTEX_WAKE_PRIVATE, 1)  = 1
socket(AF_INET, SOCK_DGRAM|SOCK_CLOEXEC|SOCK_NONBLOCK, IPPROTO_IP) = 6
setsockopt(6, SOL_SOCKET, SO_BROADCAST, [1], 4) = 0
connect(6, {sa_family=AF_INET, sin_port=htons(53), sin_addr=inet_addr("123.456.789.10")}, 16) = 0
epoll_ctl(4, EPOLL_CTL_ADD, 6, {EPOLLIN|EPOLLOUT|EPOLLRDHUP|EPOLLET, {u32=1986886384, u64=140430237596400}}) = 0
getsockname(6, {sa_family=AF_INET, sin_port=htons(38114), sin_addr=inet_addr("123.456.789.97")}, [112->16]) = 0
getpeername(6, {sa_family=AF_INET, sin_port=htons(53), sin_addr=inet_addr("123.456.789.10")}, [112->16]) = 0
futex(0xeaf3c0, FUTEX_WAKE_PRIVATE, 1)  = 1
futex(0xeaf3a0, FUTEX_WAKE_PRIVATE, 1)  = 1
write(6, "K\337\1\0\0\1\0\0\0\0\0\0\3www\10......\3com\0\0\1"..., 34) = 34
read(6, 0xc000176400, 512)              = -1 EAGAIN (Resource temporarily unavailable)
futex(0xeabf40, FUTEX_WAIT_PRIVATE, 0, NULL) = 0
futex(0xeabf40, FUTEX_WAIT_PRIVATE, 0, NULL) = 0
futex(0xeabf40, FUTEX_WAIT_PRIVATE, 0, NULL) = 0
futex(0xeabf40, FUTEX_WAIT_PRIVATE, 0, NULL) = 0
epoll_pwait(4, [], 128, 0, NULL, 0)     = 0
futex(0xc000040bc0, FUTEX_WAKE_PRIVATE, 1) = 1
read(7, 0xc0001eab81, 1)                = -1 EAGAIN (Resource temporarily unavailable)
futex(0xeabf40, FUTEX_WAIT_PRIVATE, 0, NULL) = 0
epoll_pwait(4, [], 128, 0, NULL, 0)     = 0
futex(0xeabf40, FUTEX_WAIT_PRIVATE, 0, NULL) = 0
epoll_pwait(4, [], 128, 0, NULL, 0)     = 0
epoll_pwait(4, [{EPOLLOUT, {u32=1986885552, u64=140430237595568}}], 128, -1, NULL, 3) = 1
futex(0xeab470, FUTEX_WAKE_PRIVATE, 1)  = 1
futex(0xeab390, FUTEX_WAKE_PRIVATE, 1)  = 1
getsockopt(6, SOL_SOCKET, SO_ERROR, [0], [4]) = 0
getpeername(6, {sa_family=AF_INET, sin_port=htons(443), sin_addr=inet_addr("123.456.789.12")}, [112->16]) = 0
futex(0xc000152140, FUTEX_WAKE_PRIVATE, 1) = 1
getsockname(6, {sa_family=AF_INET, sin_port=htons(35254), sin_addr=inet_addr("123.456.789.97")}, [112->16]) = 0
setsockopt(6, SOL_TCP, TCP_NODELAY, [1], 4) = 0
getrandom("\xc5\x25\x01\x66\x34\x4f\xe1\xb9\xf0\x34\x88\xb2\x49\xcc\x82\x8c\xbe\xcf\x69\x57\x55\x57\x09\x1a\x86\x3e\xab\x0f\x1e\x8d\x82\xff", 32, 0) = 32
futex(0xc000040bc0, FUTEX_WAKE_PRIVATE, 1) = 1
getrandom("\xf0\x00\x7c\x39\x32\xcd\xb6\x19\x95\x45\xc3\x72\x2a\x0e\x1a\x9f\xf3\x86\x0d\x39\x12\x3a\x26\xf4\xb2\x20\x0b\xe0\xa4\xbc\xd1\x67", 32, 0) = 32
write(6, "\26\3\1\0\242\1\0\0\236\3\3\360\0|92\315\266\31\225E\303r*\16\32\237\363\206\r9\22"..., 167) = 167
read(6, 0xc0002aa800, 1024)             = -1 EAGAIN (Resource temporarily unavailable)
futex(0xeabf40, FUTEX_WAIT_PRIVATE, 0, NULL) = 0
futex(0xeabf40, FUTEX_WAIT_PRIVATE, 0, NULL) = 0
epoll_pwait(4, [], 128, 0, NULL, 0)     = 0
epoll_pwait(4, [{EPOLLIN|EPOLLOUT, {u32=1986886384, u64=140430237596400}}], 128, -1, NULL, 3) = 1
futex(0xeab470, FUTEX_WAKE_PRIVATE, 1)  = 1
futex(0xeab390, FUTEX_WAKE_PRIVATE, 1)  = 1
read(5, "\27\3\3@\30\316\7&\331Xs/\333Y\227\316\323\354@0)f\362\247\300C\230\313-\332\rs"..., 8192) = 8192
read(5, "4Z\261<\231m\363+A\17\226F#4-\373\177\362;\305\231<3+cRH\370\321\235\312%"..., 24576) = 5888
read(5, 0xc000689700, 18688)            = -1 EAGAIN (Resource temporarily unavailable)
epoll_pwait(4, [], 128, 0, NULL, 0)     = 0
epoll_pwait(4, [{EPOLLIN|EPOLLOUT, {u32=1986886384, u64=140430237596400}}], 128, -1, NULL, 0) = 1
futex(0xeab470, FUTEX_WAKE_PRIVATE, 1)  = 1
read(5, "\352\252\301\317\vD\223\350'u\"\24c\372\247\226al]O\364D\n\337\245\v\243\227\256\370X\363"..., 18688) = 2333
futex(0xc0000f0bc0, FUTEX_WAKE_PRIVATE, 1) = 1
write(2, "ts=2019-08-20T11:10:09.675194921"..., 169) = 169
read(5, 0xc000686000, 32768)            = -1 EAGAIN (Resource temporarily unavailable)
futex(0xeabf40, FUTEX_WAIT_PRIVATE, 0, NULL) = 0
epoll_pwait(4, [], 128, 0, NULL, 0)     = 0
epoll_pwait(4, [{EPOLLIN|EPOLLOUT, {u32=1986885344, u64=140430237595360}}], 128, -1, NULL, 3) = 1
futex(0xeab470, FUTEX_WAKE_PRIVATE, 1)  = 1
futex(0xeab390, FUTEX_WAKE_PRIVATE, 1)  = 1
read(13, "GET /probe?module=http_2xx&targe"..., 4096) = 283
futex(0xc000152140, FUTEX_WAKE_PRIVATE, 1) = 1
futex(0xeaf340, FUTEX_WAKE_PRIVATE, 1)  = 1
futex(0xeaf320, FUTEX_WAKE_PRIVATE, 1)  = 1
write(2, "ts=2019-08-20T11:10:11.550622968"..., 190) = 190
futex(0xc0000f0bc0, FUTEX_WAKE_PRIVATE, 1) = 1
futex(0xeabf40, FUTEX_WAIT_PRIVATE, 0, NULL) = 0
futex(0xeab460, FUTEX_WAKE_PRIVATE, 1)  = 0
futex(0xeab390, FUTEX_WAKE_PRIVATE, 1)  = 1
futex(0xeabf40, FUTEX_WAIT_PRIVATE, 0, NULL) = 0
nanosleep({tv_sec=0, tv_nsec=3000}, NULL) = 0
nanosleep({tv_sec=0, tv_nsec=3000}, NULL) = 0
read(6, "\246\237\201\200\0\1\0\2\0\0\0\0\17..........\10......"..., 512) = 82
futex(0xeab460, FUTEX_WAKE_PRIVATE, 1)  = 1
futex(0xeab390, FUTEX_WAKE_PRIVATE, 1)  = 1
sched_yield()                           = 0
futex(0xeab390, FUTEX_WAKE_PRIVATE, 1)  = 0
futex(0xeabf40, FUTEX_WAIT_PRIVATE, 0, NULL) = -1 EAGAIN (Resource temporarily unavailable)
futex(0xc0001daf40, FUTEX_WAKE_PRIVATE, 1) = 1
futex(0xeaf340, FUTEX_WAIT_PRIVATE, 0, {tv_sec=4, tv_nsec=999781213}) = 0
futex(0xeab470, FUTEX_WAKE_PRIVATE, 1)  = 1
futex(0xeab390, FUTEX_WAKE_PRIVATE, 1)  = 1
epoll_pwait(4, [], 128, 0, NULL, 3200768026) = 0
futex(0xeabf40, FUTEX_WAIT_PRIVATE, 0, NULL) = -1 EAGAIN (Resource temporarily unavailable)
futex(0xeabf40, FUTEX_WAIT_PRIVATE, 0, NULL) = 0
futex(0xeabf40, FUTEX_WAIT_PRIVATE, 0, NULL) = 0
futex(0xeabf40, FUTEX_WAIT_PRIVATE, 0, NULL) = 0
futex(0xeabf40, FUTEX_WAIT_PRIVATE, 0, NULL) = 0
epoll_pwait(4, [], 128, 0, NULL, 0)     = 0
epoll_pwait(4, [{EPOLLIN|EPOLLOUT, {u32=1986887008, u64=140430237597024}}], 128, -1, NULL, 3) = 1
futex(0xeab470, FUTEX_WAKE_PRIVATE, 1)  = 1
futex(0xeab390, FUTEX_WAKE_PRIVATE, 1)  = 1
```

**Comment by brian-brazil** [comment]
Has the pod been running on different machines? Does the same happen if it runs outside of k8s?

That strace doesn't look complete, there's FDs being reused without being closed first.

**Comment by starcry** [comment]
> Has the pod been running on different machines?

It's running in the google cloud k8s service so I imagine it probabaly would have been scaled up and down to different vms at some point but I've no way to tell you exactly what was where.

> Does the same happen if it runs outside of k8s?

I recently migrated our monitoring and by consiquence blackbox exporter, into k8s, it was running with dokku previously and we didn't see any issues there.

> That strace doesn't look complete, there's FDs being reused without being closed first.

I'm not very familiar with the in's and out's of strace, I currently have a file that 30 thousand lines which I'm guessing is a lot more than what you want, could you give me some more information as to exactly what you're looking for so I can narrow things down for you?

**Comment by brian-brazil** [comment]
I'm looking for a full trace of a failure, if you can have timestamps matched with a tcpdump that'd help.

**Comment by starcry** [comment]
here is the tcp dump of a failure along with it's associated failure in the blackbox exporter logs

blackbox exporter logs
```
ts=2019-08-21T09:17:34.576147114Z caller=main.go:174 module=http_2xx target=https://www.url.com:443/ level=debug msg="Beginning probe" probe=http timeout_seconds=19.5
ts=2019-08-21T09:17:34.576829474Z caller=main.go:174 module=http_2xx target=https://www.url.com:443/ level=debug msg="Resolving target address" ip_protocol=ip4
ts=2019-08-21T09:17:34.578891662Z caller=main.go:174 module=http_2xx target=https://www.url.com:443/ level=debug msg="Resolved target address" ip=123.456.789.12
ts=2019-08-21T09:17:34.579089001Z caller=main.go:174 module=http_2xx target=https://www.url.com:443/ level=debug msg="Making HTTP request" url=https://123.456.789.12:443/ host=www.url.com:443

ts=2019-08-21T09:17:42.969264168Z caller=main.go:174 module=http_2xx target=https://www.url.com:443/ level=debug msg="Beginning probe" probe=http timeout_seconds=19.5
ts=2019-08-21T09:17:42.970032816Z caller=main.go:174 module=http_2xx target=https://www.url.com:443/ level=debug msg="Resolving target address" ip_protocol=ip4
ts=2019-08-21T09:17:42.971965131Z caller=main.go:174 module=http_2xx target=https://www.url.com:443/ level=debug msg="Resolved target address" ip=123.456.789.12
ts=2019-08-21T09:17:42.972150449Z caller=main.go:174 module=http_2xx target=https://www.url.com:443/ level=debug msg="Making HTTP request" url=https://123.456.789.12:443/ host=www.url.com:443
ts=2019-08-21T09:17:43.290199444Z caller=main.go:174 module=http_2xx target=https://www.url.com:443/ level=debug msg="Received HTTP response" status_code=200
ts=2019-08-21T09:17:43.2914829Z caller=main.go:174 module=http_2xx target=https://www.url.com:443/ level=debug msg="Response timings for roundtrip" roundtrip=0 start=2019-08-21T09:17:42.972379652Z dnsDone=2019-08-21T09:17:42.972379652Z connectDone=2019-08-21T09:17:42.983706975Z gotConn=2019-08-21T09:17:43.008876368Z responseStart=2019-08-21T09:17:43.29003545Z end=2019-08-21T09:17:43.291367276Z
ts=2019-08-21T09:17:43.29159965Z caller=main.go:174 module=http_2xx target=https://www.url.com:443/ level=debug msg="Probe succeeded" duration_seconds=0.322110117

ts=2019-08-21T09:17:54.076323711Z caller=main.go:174 module=http_2xx target=https://www.url.com:443/ level=debug msg="Error for HTTP request" err="Get https://123.456.789.12:443/: context deadline exceeded"
ts=2019-08-21T09:17:54.076425664Z caller=main.go:174 module=http_2xx target=https://www.url.com:443/ level=debug msg="Response timings for roundtrip" roundtrip=0 start=2019-08-21T09:17:34.579178636Z dnsDone=2019-08-21T09:17:34.579178636Z connectDone=0001-01-01T00:00:00Z gotConn=0001-01-01T00:00:00Z responseStart=0001-01-01T00:00:00Z end=0001-01-01T00:00:00Z
ts=2019-08-21T09:17:54.076492932Z caller=main.go:174 module=http_2xx target=https://www.url.com:443/ level=debug msg="Probe failed" duration_seconds=19.50024272
```

tcpdump
```
2019-08-21 09:17:34.575780 IP (tos 0x0, ttl 64, id 44457, offset 0, flags [DF], proto TCP (6), length 350)
    123.456.789.85.39968 > 123.456.789.112.9115: Flags [P.], cksum 0x167d (incorrect -> 0xdab8), seq 51383:51681, ack 144887, win 1329, options [nop,nop,TS val 1870381113 ecr 162300441], length 298
2019-08-21 09:17:34.577319 IP (tos 0x0, ttl 64, id 28548, offset 0, flags [DF], proto UDP (17), length 62)
    123.456.789.112.44003 > 123.456.789.10.53: [bad udp cksum 0x1521 -> 0xa27c!] 37087+ AAAA? www........com. (34)
2019-08-21 09:17:34.577635 IP (tos 0x0, ttl 64, id 28549, offset 0, flags [DF], proto UDP (17), length 62)
    123.456.789.112.33469 > 123.456.789.10.53: [bad udp cksum 0x1521 -> 0xfc48!] 24660+ A? www........com. (34)
2019-08-21 09:17:34.577752 IP (tos 0x0, ttl 64, id 27721, offset 0, flags [DF], proto UDP (17), length 140)
    123.456.789.10.53 > 123.456.789.112.33469: [bad udp cksum 0x156f -> 0xf661!] 24660 q: A? www........com. 2/0/0 www........com. [2m22s] CNAME server.url.com., server.url.com. [1h2m22s] A 123.456.789.12 (112)
2019-08-21 09:17:34.578611 IP (tos 0x0, ttl 64, id 27722, offset 0, flags [DF], proto UDP (17), length 189)
    123.456.789.10.53 > 123.456.789.112.44003: [bad udp cksum 0x15a0 -> 0x8446!] 37087 q: AAAA? www........com. 1/1/0 www........com. [2m24s] CNAME server.url.com. ns: name.server.com. [2m24s] SOA dns-external-master.amazon.com. root.amazon.com. 2013120667 28800 900 604800 7207 (161)
2019-08-21 09:17:34.579246 IP (tos 0x0, ttl 64, id 52851, offset 0, flags [DF], proto TCP (6), length 60)
    123.456.789.112.34210 > 123.456.789.12.443: Flags [S], cksum 0x1cf1 (incorrect -> 0x7415), seq 4001060753, win 28400, options [mss 1420,sackOK,TS val 2751780592 ecr 0,nop,wscale 7], length 0
2019-08-21 09:17:34.616542 IP (tos 0x0, ttl 64, id 63693, offset 0, flags [DF], proto TCP (6), length 52)
    123.456.789.112.9115 > 123.456.789.85.39968: Flags [.], cksum 0x1553 (incorrect -> 0x37a6), seq 144887, ack 51681, win 1337, options [nop,nop,TS val 162302242 ecr 1870381113], length 0
2019-08-21 09:17:34.915847 IP (tos 0x0, ttl 64, id 39407, offset 0, flags [DF], proto TCP (6), length 328)
    123.456.789.86.56886 > 123.456.789.112.9115: Flags [P.], cksum 0x1668 (incorrect -> 0x47d6), seq 85475:85751, ack 239260, win 1329, options [nop,nop,TS val 3893293586 ecr 1922790433], length 276
2019-08-21 09:17:34.917092 IP (tos 0x0, ttl 64, id 28888, offset 0, flags [DF], proto UDP (17), length 62)
    123.456.789.112.36749 > 123.456.789.10.53: [bad udp cksum 0x1521 -> 0x6042!] 61295+ AAAA? www........com. (34)
2019-08-21 09:17:34.918026 IP (tos 0x0, ttl 64, id 28889, offset 0, flags [DF], proto UDP (17), length 62)
    123.456.789.112.45875 > 123.456.789.10.53: [bad udp cksum 0x1521 -> 0x3b6f!] 61623+ A? www........com. (34)
2019-08-21 09:17:34.918447 IP (tos 0x0, ttl 64, id 27790, offset 0, flags [DF], proto UDP (17), length 189)
    123.456.789.10.53 > 123.456.789.112.36749: [bad udp cksum 0x15a0 -> 0x420c!] 61295 q: AAAA? www........com. 1/1/0 www........com. [2m24s] CNAME server.url.com. ns: name.server.com. [2m24s] SOA dns-external-master.amazon.com. root.amazon.com. 2013120667 28800 900 604800 7207 (161)
2019-08-21 09:17:34.919555 IP (tos 0x0, ttl 64, id 27791, offset 0, flags [DF], proto UDP (17), length 137)
    123.456.789.10.53 > 123.456.789.112.45875: [bad udp cksum 0x156c -> 0xdb54!] 61623 q: A? www........com. 2/0/0 www........com. [2m22s] CNAME server.url.com., server.url.com. [1h2m22s] A 123.456.789.12 (109)
2019-08-21 09:17:34.919928 IP (tos 0x0, ttl 64, id 20939, offset 0, flags [DF], proto TCP (6), length 60)
    123.456.789.112.34214 > 123.456.789.12.443: Flags [S], cksum 0x1cf1 (incorrect -> 0x3a45), seq 3012020988, win 28400, options [mss 1420,sackOK,TS val 2751780933 ecr 0,nop,wscale 7], length 0
2019-08-21 09:17:34.932518 IP (tos 0x60, ttl 44, id 0, offset 0, flags [DF], proto TCP (6), length 60)
    123.456.789.12.443 > 123.456.789.112.34214: Flags [S.], cksum 0x11df (correct), seq 3343114019, ack 3012020989, win 26847, options [mss 1460,sackOK,TS val 1981026754 ecr 2751780933,nop,wscale 7], length 0
2019-08-21 09:17:34.932566 IP (tos 0x0, ttl 64, id 20940, offset 0, flags [DF], proto TCP (6), length 52)
    123.456.789.112.34214 > 123.456.789.12.443: Flags [.], cksum 0x1ce9 (incorrect -> 0xa89f), seq 1, ack 1, win 222, options [nop,nop,TS val 2751780946 ecr 1981026754], length 0
2019-08-21 09:17:34.932869 IP (tos 0x0, ttl 64, id 20941, offset 0, flags [DF], proto TCP (6), length 219)
    123.456.789.112.34214 > 123.456.789.12.443: Flags [P.], cksum 0x1d90 (incorrect -> 0x185e), seq 1:168, ack 1, win 222, options [nop,nop,TS val 2751780946 ecr 1981026754], length 167
2019-08-21 09:17:34.945361 IP (tos 0x60, ttl 44, id 52961, offset 0, flags [DF], proto TCP (6), length 52)
    123.456.789.12.443 > 123.456.789.112.34214: Flags [.], cksum 0xa7f8 (correct), seq 1, ack 168, win 219, options [nop,nop,TS val 1981026757 ecr 2751780946], length 0
2019-08-21 09:17:34.945488 IP (tos 0x60, ttl 44, id 52962, offset 0, flags [DF], proto TCP (6), length 4148)
    123.456.789.12.443 > 123.456.789.112.34214: Flags [P.], cksum 0x2ce9 (incorrect -> 0xb490), seq 1:4097, ack 168, win 219, options [nop,nop,TS val 1981026757 ecr 2751780946], length 4096
2019-08-21 09:17:34.945513 IP (tos 0x0, ttl 64, id 20942, offset 0, flags [DF], proto TCP (6), length 52)
    123.456.789.112.34214 > 123.456.789.12.443: Flags [.], cksum 0x1ce9 (incorrect -> 0x97a8), seq 168, ack 4097, win 286, options [nop,nop,TS val 2751780959 ecr 1981026757], length 0
2019-08-21 09:17:34.946185 IP (tos 0x60, ttl 44, id 52965, offset 0, flags [DF], proto TCP (6), length 1576)
    123.456.789.12.443 > 123.456.789.112.34214: Flags [P.], cksum 0x22dd (incorrect -> 0xbf51), seq 4097:5621, ack 168, win 219, options [nop,nop,TS val 1981026758 ecr 2751780946], length 1524
2019-08-21 09:17:34.946194 IP (tos 0x0, ttl 64, id 20943, offset 0, flags [DF], proto TCP (6), length 52)
    123.456.789.112.34214 > 123.456.789.12.443: Flags [.], cksum 0x1ce9 (incorrect -> 0x919b), seq 168, ack 5621, win 310, options [nop,nop,TS val 2751780959 ecr 1981026758], length 0
2019-08-21 09:17:34.948244 IP (tos 0x0, ttl 64, id 20944, offset 0, flags [DF], proto TCP (6), length 145)
    123.456.789.112.34214 > 123.456.789.12.443: Flags [P.], cksum 0x1d46 (incorrect -> 0x8c64), seq 168:261, ack 5621, win 310, options [nop,nop,TS val 2751780961 ecr 1981026758], length 93
2019-08-21 09:17:34.956567 IP (tos 0x0, ttl 64, id 31352, offset 0, flags [DF], proto TCP (6), length 52)
    123.456.789.112.9115 > 123.456.789.86.56886: Flags [.], cksum 0x1554 (incorrect -> 0x43a3), seq 239260, ack 85751, win 1337, options [nop,nop,TS val 1922792792 ecr 3893293586], length 0
2019-08-21 09:17:34.960948 IP (tos 0x60, ttl 44, id 52967, offset 0, flags [DF], proto TCP (6), length 103)
    123.456.789.12.443 > 123.456.789.112.34214: Flags [P.], cksum 0x427d (correct), seq 5621:5672, ack 261, win 219, options [nop,nop,TS val 1981026761 ecr 2751780961], length 51
2019-08-21 09:17:34.961315 IP (tos 0x0, ttl 64, id 20945, offset 0, flags [DF], proto TCP (6), length 212)
    123.456.789.112.34214 > 123.456.789.12.443: Flags [P.], cksum 0x1d89 (incorrect -> 0x3a56), seq 261:421, ack 5672, win 310, options [nop,nop,TS val 2751780974 ecr 1981026761], length 160
2019-08-21 09:17:35.010181 IP (tos 0x60, ttl 44, id 52968, offset 0, flags [DF], proto TCP (6), length 52)
    123.456.789.12.443 > 123.456.789.112.34214: Flags [.], cksum 0x909f (correct), seq 5672, ack 421, win 227, options [nop,nop,TS val 1981026774 ecr 2751780974], length 0
2019-08-21 09:17:35.105360 IP (tos 0x60, ttl 44, id 52969, offset 0, flags [DF], proto TCP (6), length 1704)
    123.456.789.12.443 > 123.456.789.112.34214: Flags [P.], cksum 0x235d (incorrect -> 0x609c), seq 5672:7324, ack 421, win 227, options [nop,nop,TS val 1981026797 ecr 2751780974], length 1652
2019-08-21 09:17:35.105401 IP (tos 0x0, ttl 64, id 20946, offset 0, flags [DF], proto TCP (6), length 52)
    123.456.789.112.34214 > 123.456.789.12.443: Flags [.], cksum 0x1ce9 (incorrect -> 0x8917), seq 421, ack 7324, win 336, options [nop,nop,TS val 2751781118 ecr 1981026797], length 0
2019-08-21 09:17:35.105403 IP (tos 0x60, ttl 44, id 52971, offset 0, flags [DF], proto TCP (6), length 83)
    123.456.789.12.443 > 123.456.789.112.34214: Flags [P.], cksum 0x74f5 (correct), seq 7324:7355, ack 421, win 227, options [nop,nop,TS val 1981026797 ecr 2751780974], length 31
2019-08-21 09:17:35.105408 IP (tos 0x60, ttl 44, id 52972, offset 0, flags [DF], proto TCP (6), length 52)
    123.456.789.12.443 > 123.456.789.112.34214: Flags [F.], cksum 0x89f4 (correct), seq 7355, ack 421, win 227, options [nop,nop,TS val 1981026797 ecr 2751780974], length 0
2019-08-21 09:17:35.105854 IP (tos 0x0, ttl 64, id 20947, offset 0, flags [DF], proto TCP (6), length 83)
    123.456.789.112.34214 > 123.456.789.12.443: Flags [P.], cksum 0x1d08 (incorrect -> 0xbd6e), seq 421:452, ack 7356, win 336, options [nop,nop,TS val 2751781119 ecr 1981026797], length 31
2019-08-21 09:17:35.105897 IP (tos 0x0, ttl 64, id 20948, offset 0, flags [DF], proto TCP (6), length 52)
    123.456.789.112.34214 > 123.456.789.12.443: Flags [F.], cksum 0x1ce9 (incorrect -> 0x88d6), seq 452, ack 7356, win 336, options [nop,nop,TS val 2751781119 ecr 1981026797], length 0
2019-08-21 09:17:35.109415 IP (tos 0x0, ttl 64, id 31353, offset 0, flags [DF], proto TCP (6), length 836)
    123.456.789.112.9115 > 123.456.789.86.56886: Flags [P.], cksum 0x1864 (incorrect -> 0x5318), seq 239260:240044, ack 85751, win 1337, options [nop,nop,TS val 1922792944 ecr 3893293586], length 784
2019-08-21 09:17:35.109501 IP (tos 0x0, ttl 64, id 39408, offset 0, flags [DF], proto TCP (6), length 52)
    123.456.789.86.56886 > 123.456.789.112.9115: Flags [.], cksum 0x1554 (incorrect -> 0x3f41), seq 85751, ack 240044, win 1329, options [nop,nop,TS val 3893293780 ecr 1922792944], length 0
2019-08-21 09:17:35.118595 IP (tos 0x60, ttl 44, id 43361, offset 0, flags [DF], proto TCP (6), length 40)
    123.456.789.12.443 > 123.456.789.112.34214: Flags [R], cksum 0x4899 (correct), seq 3343121375, win 0, length 0
2019-08-21 09:17:35.118619 IP (tos 0x60, ttl 44, id 43362, offset 0, flags [DF], proto TCP (6), length 40)
    123.456.789.12.443 > 123.456.789.112.34214: Flags [R], cksum 0x4899 (correct), seq 3343121375, win 0, length 0
2019-08-21 09:17:35.632541 IP (tos 0x0, ttl 64, id 52852, offset 0, flags [DF], proto TCP (6), length 60)
    123.456.789.112.34210 > 123.456.789.12.443: Flags [S], cksum 0x1cf1 (incorrect -> 0x6ff7), seq 4001060753, win 28400, options [mss 1420,sackOK,TS val 2751781646 ecr 0,nop,wscale 7], length 0
2019-08-21 09:17:36.606295 IP (tos 0x60, ttl 44, id 55, offset 0, flags [DF], proto TCP (6), length 14132)
    123.456.789.12.443 > 123.456.789.112.34180: Flags [.], cksum 0x53e9 (incorrect -> 0x33aa), seq 5672:19752, ack 430, win 227, options [nop,nop,TS val 1981027173 ecr 2751776941], length 14080
2019-08-21 09:17:36.606329 IP (tos 0x0, ttl 64, id 44331, offset 0, flags [DF], proto TCP (6), length 52)
    123.456.789.112.34180 > 123.456.789.12.443: Flags [.], cksum 0x1ce9 (incorrect -> 0xa0c3), seq 430, ack 19752, win 530, options [nop,nop,TS val 2751782619 ecr 1981027173], length 0
2019-08-21 09:17:36.617387 IP (tos 0x60, ttl 44, id 65, offset 0, flags [DF], proto TCP (6), length 6290)
    123.456.789.12.443 > 123.456.789.112.34180: Flags [FP.], cksum 0x3547 (incorrect -> 0xc28f), seq 19752:25990, ack 430, win 227, options [nop,nop,TS val 1981027175 ecr 2751782619], length 6238
2019-08-21 09:17:36.617419 IP (tos 0x0, ttl 64, id 44332, offset 0, flags [DF], proto TCP (6), length 52)
    123.456.789.112.34180 > 123.456.789.12.443: Flags [.], cksum 0x1ce9 (incorrect -> 0x87f5), seq 430, ack 25991, win 628, options [nop,nop,TS val 2751782630 ecr 1981027175], length 0
2019-08-21 09:17:36.619317 IP (tos 0x0, ttl 64, id 44333, offset 0, flags [DF], proto TCP (6), length 83)
    123.456.789.112.34180 > 123.456.789.12.443: Flags [P.], cksum 0x1d08 (incorrect -> 0xae1e), seq 430:461, ack 25991, win 628, options [nop,nop,TS val 2751782632 ecr 1981027175], length 31
2019-08-21 09:17:36.619375 IP (tos 0x0, ttl 64, id 44334, offset 0, flags [DF], proto TCP (6), length 52)
    123.456.789.112.34180 > 123.456.789.12.443: Flags [F.], cksum 0x1ce9 (incorrect -> 0x87d3), seq 461, ack 25991, win 628, options [nop,nop,TS val 2751782632 ecr 1981027175], length 0
2019-08-21 09:17:36.623704 IP (tos 0x0, ttl 64, id 34655, offset 0, flags [DF], proto TCP (6), length 836)
    123.456.789.112.9115 > 123.456.789.85.35972: Flags [P.], cksum 0x1863 (incorrect -> 0x2de7), seq 257445:258229, ack 92304, win 1337, options [nop,nop,TS val 162304249 ecr 1870377423], length 784
2019-08-21 09:17:36.623818 IP (tos 0x0, ttl 64, id 311, offset 0, flags [DF], proto TCP (6), length 52)
    123.456.789.85.35972 > 123.456.789.112.9115: Flags [.], cksum 0x1553 (incorrect -> 0x6822), seq 92304, ack 258229, win 1329, options [nop,nop,TS val 1870383161 ecr 162304249], length 0
2019-08-21 09:17:36.630195 IP (tos 0x60, ttl 44, id 43687, offset 0, flags [DF], proto TCP (6), length 40)
    123.456.789.12.443 > 123.456.789.112.34180: Flags [R], cksum 0x2282 (correct), seq 1977381760, win 0, length 0
2019-08-21 09:17:36.630212 IP (tos 0x60, ttl 44, id 43688, offset 0, flags [DF], proto TCP (6), length 40)
    123.456.789.12.443 > 123.456.789.112.34180: Flags [R], cksum 0x2282 (correct), seq 1977381760, win 0, length 0
2019-08-21 09:17:37.680568 IP (tos 0x0, ttl 64, id 52853, offset 0, flags [DF], proto TCP (6), length 60)
    123.456.789.112.34210 > 123.456.789.12.443: Flags [S], cksum 0x1cf1 (incorrect -> 0x67f8), seq 4001060753, win 28400, options [mss 1420,sackOK,TS val 2751783693 ecr 0,nop,wscale 7], length 0
2019-08-21 09:17:38.220119 ARP, Ethernet (len 6), IPv4 (len 4), Request who-has 123.456.789.81 tell 123.456.789.25, length 28
2019-08-21 09:17:39.281822 IP (tos 0x0, ttl 64, id 39409, offset 0, flags [DF], proto TCP (6), length 339)
    123.456.789.86.56886 > 123.456.789.112.9115: Flags [P.], cksum 0x1673 (incorrect -> 0x5b0f), seq 85751:86038, ack 240044, win 1329, options [nop,nop,TS val 3893297951 ecr 1922792944], length 287
2019-08-21 09:17:39.281848 IP (tos 0x0, ttl 64, id 31354, offset 0, flags [DF], proto TCP (6), length 52)
    123.456.789.112.9115 > 123.456.789.86.56886: Flags [.], cksum 0x1554 (incorrect -> 0x1d82), seq 240044, ack 86038, win 1337, options [nop,nop,TS val 1922797117 ecr 3893297951], length 0
2019-08-21 09:17:39.282863 IP (tos 0x0, ttl 64, id 30809, offset 0, flags [DF], proto UDP (17), length 62)
    123.456.789.112.40550 > 123.456.789.10.53: [bad udp cksum 0x1521 -> 0xb98b!] 34664+ A? www........com. (34)
2019-08-21 09:17:39.283044 IP (tos 0x0, ttl 64, id 30492, offset 0, flags [DF], proto UDP (17), length 140)
    123.456.789.10.53 > 123.456.789.112.40550: [bad udp cksum 0x156f -> 0xb3ae!] 34664 q: A? www........com. 2/0/0 www........com. [2m17s] CNAME server.url.com., server.url.com. [1h2m17s] A 123.456.789.12 (112)
2019-08-21 09:17:39.283127 IP (tos 0x0, ttl 64, id 30810, offset 0, flags [DF], proto UDP (17), length 62)
    123.456.789.112.38125 > 123.456.789.10.53: [bad udp cksum 0x1521 -> 0x69cd!] 57476+ AAAA? www........com. (34)
2019-08-21 09:17:39.284298 IP (tos 0x0, ttl 64, id 30493, offset 0, flags [DF], proto UDP (17), length 189)
    123.456.789.10.53 > 123.456.789.112.38125: [bad udp cksum 0x15a0 -> 0x509c!] 57476 q: AAAA? www........com. 1/1/0 www........com. [2m19s] CNAME server.url.com. ns: name.server.com. [2m19s] SOA dns-external-master.amazon.com. root.amazon.com. 2013120667 28800 900 604800 7207 (161)
2019-08-21 09:17:39.284875 IP (tos 0x0, ttl 64, id 23627, offset 0, flags [DF], proto TCP (6), length 60)
    123.456.789.112.34666 > 123.456.789.12.443: Flags [S], cksum 0x1cf1 (incorrect -> 0x5001), seq 1709699087, win 28400, options [mss 1420,sackOK,TS val 2751785298 ecr 0,nop,wscale 7], length 0
2019-08-21 09:17:39.297332 IP (tos 0x60, ttl 44, id 0, offset 0, flags [DF], proto TCP (6), length 60)
    123.456.789.12.443 > 123.456.789.112.34666: Flags [S.], cksum 0x90d1 (correct), seq 784468524, ack 1709699088, win 26847, options [mss 1460,sackOK,TS val 1981027845 ecr 2751785298,nop,wscale 7], length 0
2019-08-21 09:17:39.297370 IP (tos 0x0, ttl 64, id 23628, offset 0, flags [DF], proto TCP (6), length 52)
    123.456.789.112.34666 > 123.456.789.12.443: Flags [.], cksum 0x1ce9 (incorrect -> 0x2793), seq 1, ack 1, win 222, options [nop,nop,TS val 2751785310 ecr 1981027845], length 0
2019-08-21 09:17:39.297665 IP (tos 0x0, ttl 64, id 23629, offset 0, flags [DF], proto TCP (6), length 219)
    123.456.789.112.34666 > 123.456.789.12.443: Flags [P.], cksum 0x1d90 (incorrect -> 0x9480), seq 1:168, ack 1, win 222, options [nop,nop,TS val 2751785310 ecr 1981027845], length 167
2019-08-21 09:17:39.310130 IP (tos 0x60, ttl 44, id 7204, offset 0, flags [DF], proto TCP (6), length 52)
    123.456.789.12.443 > 123.456.789.112.34666: Flags [.], cksum 0x26eb (correct), seq 1, ack 168, win 219, options [nop,nop,TS val 1981027849 ecr 2751785310], length 0
2019-08-21 09:17:39.310250 IP (tos 0x60, ttl 44, id 7205, offset 0, flags [DF], proto TCP (6), length 4148)
    123.456.789.12.443 > 123.456.789.112.34666: Flags [P.], cksum 0x2ce9 (incorrect -> 0xa8c3), seq 1:4097, ack 168, win 219, options [nop,nop,TS val 1981027849 ecr 2751785310], length 4096
2019-08-21 09:17:39.310285 IP (tos 0x0, ttl 64, id 23630, offset 0, flags [DF], proto TCP (6), length 52)
    123.456.789.112.34666 > 123.456.789.12.443: Flags [.], cksum 0x1ce9 (incorrect -> 0x169b), seq 168, ack 4097, win 286, options [nop,nop,TS val 2751785323 ecr 1981027849], length 0
2019-08-21 09:17:39.310933 IP (tos 0x60, ttl 44, id 7208, offset 0, flags [DF], proto TCP (6), length 1576)
    123.456.789.12.443 > 123.456.789.112.34666: Flags [P.], cksum 0x22dd (incorrect -> 0xd80b), seq 4097:5621, ack 168, win 219, options [nop,nop,TS val 1981027849 ecr 2751785310], length 1524
2019-08-21 09:17:39.310942 IP (tos 0x0, ttl 64, id 23631, offset 0, flags [DF], proto TCP (6), length 52)
    123.456.789.112.34666 > 123.456.789.12.443: Flags [.], cksum 0x1ce9 (incorrect -> 0x108e), seq 168, ack 5621, win 310, options [nop,nop,TS val 2751785324 ecr 1981027849], length 0
2019-08-21 09:17:39.312938 IP (tos 0x0, ttl 64, id 23632, offset 0, flags [DF], proto TCP (6), length 145)
    123.456.789.112.34666 > 123.456.789.12.443: Flags [P.], cksum 0x1d46 (incorrect -> 0xca54), seq 168:261, ack 5621, win 310, options [nop,nop,TS val 2751785326 ecr 1981027849], length 93
2019-08-21 09:17:39.325832 IP (tos 0x60, ttl 44, id 7210, offset 0, flags [DF], proto TCP (6), length 103)
    123.456.789.12.443 > 123.456.789.112.34666: Flags [P.], cksum 0xfc38 (correct), seq 5621:5672, ack 261, win 219, options [nop,nop,TS val 1981027852 ecr 2751785326], length 51
2019-08-21 09:17:39.326331 IP (tos 0x0, ttl 64, id 23633, offset 0, flags [DF], proto TCP (6), length 221)
    123.456.789.112.34666 > 123.456.789.12.443: Flags [P.], cksum 0x1d92 (incorrect -> 0xd959), seq 261:430, ack 5672, win 310, options [nop,nop,TS val 2751785339 ecr 1981027852], length 169
2019-08-21 09:17:39.378269 IP (tos 0x60, ttl 44, id 7211, offset 0, flags [DF], proto TCP (6), length 52)
    123.456.789.12.443 > 123.456.789.112.34666: Flags [.], cksum 0x0f88 (correct), seq 5672, ack 430, win 227, options [nop,nop,TS val 1981027866 ecr 2751785339], length 0
2019-08-21 09:17:41.190074 IP (tos 0x0, ttl 64, id 24173, offset 0, flags [DF], proto TCP (6), length 328)
    123.456.789.86.56168 > 123.456.789.112.9115: Flags [P.], cksum 0x1668 (incorrect -> 0xfb31), seq 58791:59067, ack 164698, win 1329, options [nop,nop,TS val 3893299860 ecr 1922767478], length 276
2019-08-21 09:17:41.190117 IP (tos 0x0, ttl 64, id 18202, offset 0, flags [DF], proto TCP (6), length 52)
    123.456.789.112.9115 > 123.456.789.86.56168: Flags [.], cksum 0x1554 (incorrect -> 0x3c71), seq 164698, ack 59067, win 1337, options [nop,nop,TS val 1922799025 ecr 3893299860], length 0
2019-08-21 09:17:41.190937 IP (tos 0x0, ttl 64, id 31581, offset 0, flags [DF], proto UDP (17), length 73)
    123.456.789.112.41449 > 123.456.789.10.53: [bad udp cksum 0x152c -> 0x968c!] 23998+ AAAA? search-service........com. (45)
2019-08-21 09:17:41.191406 IP (tos 0x0, ttl 64, id 31582, offset 0, flags [DF], proto UDP (17), length 73)
    123.456.789.112.57840 > 123.456.789.10.53: [bad udp cksum 0x152c -> 0xa360!] 11235+ A? search-service........com. (45)
2019-08-21 09:17:41.191532 IP (tos 0x0, ttl 64, id 31109, offset 0, flags [DF], proto UDP (17), length 121)
    123.456.789.10.53 > 123.456.789.112.57840: [bad udp cksum 0x155c -> 0xdd0a!] 11235 q: A? search-service........com. 2/0/0 search-service........com. [2m50s] CNAME ........com., ........com. [2m50s] A 123.456.789.74 (93)
2019-08-21 09:17:41.192452 IP (tos 0x0, ttl 64, id 31110, offset 0, flags [DF], proto UDP (17), length 174)
    123.456.789.10.53 > 123.456.789.112.41449: [bad udp cksum 0x1591 -> 0x0e75!] 23998 q: AAAA? search-service........com. 1/1/0 search-service........com. [2m50s] CNAME ........com. ns: .......com. [13m50s] SOA ns.soa.net. awsdns-hostmaster.amazon.com. 1 7200 900 1209600 86400 (146)
2019-08-21 09:17:41.193176 IP (tos 0x0, ttl 64, id 53893, offset 0, flags [DF], proto TCP (6), length 60)
    123.456.789.112.43442 > 123.456.789.74.443: Flags [S], cksum 0x91e5 (incorrect -> 0xea52), seq 1679647037, win 28400, options [mss 1420,sackOK,TS val 3522959977 ecr 0,nop,wscale 7], length 0
2019-08-21 09:17:41.194313 IP (tos 0x60, ttl 121, id 11876, offset 0, flags [none], proto TCP (6), length 60)
    123.456.789.74.443 > 123.456.789.112.43442: Flags [S.], cksum 0x2bc5 (correct), seq 506921302, ack 1679647038, win 60192, options [mss 1380,sackOK,TS val 3656337654 ecr 3522959977,nop,wscale 8], length 0
2019-08-21 09:17:41.194341 IP (tos 0x0, ttl 64, id 53894, offset 0, flags [DF], proto TCP (6), length 52)
    123.456.789.112.43442 > 123.456.789.74.443: Flags [.], cksum 0x91dd (incorrect -> 0x4484), seq 1, ack 1, win 222, options [nop,nop,TS val 3522959978 ecr 3656337654], length 0
2019-08-21 09:17:41.194558 IP (tos 0x0, ttl 64, id 53895, offset 0, flags [DF], proto TCP (6), length 230)
    123.456.789.112.43442 > 123.456.789.74.443: Flags [P.], cksum 0x928f (incorrect -> 0x8049), seq 1:179, ack 1, win 222, options [nop,nop,TS val 3522959978 ecr 3656337654], length 178
2019-08-21 09:17:41.195643 IP (tos 0x60, ttl 121, id 11877, offset 0, flags [none], proto TCP (6), length 52)
    123.456.789.74.443 > 123.456.789.112.43442: Flags [.], cksum 0x43bf (correct), seq 1, ack 179, win 240, options [nop,nop,TS val 3656337655 ecr 3522959978], length 0
2019-08-21 09:17:41.197881 IP (tos 0x60, ttl 121, id 11879, offset 0, flags [none], proto TCP (6), length 5178)
    123.456.789.74.443 > 123.456.789.112.43442: Flags [P.], cksum 0xa5e3 (incorrect -> 0x43c2), seq 1:5127, ack 179, win 240, options [nop,nop,TS val 3656337657 ecr 3522959978], length 5126
2019-08-21 09:17:41.197904 IP (tos 0x0, ttl 64, id 53896, offset 0, flags [DF], proto TCP (6), length 52)
    123.456.789.112.43442 > 123.456.789.74.443: Flags [.], cksum 0x91dd (incorrect -> 0x2f76), seq 179, ack 5127, win 302, options [nop,nop,TS val 3522959981 ecr 3656337657], length 0
2019-08-21 09:17:41.201394 IP (tos 0x0, ttl 64, id 53897, offset 0, flags [DF], proto TCP (6), length 145)
    123.456.789.112.43442 > 123.456.789.74.443: Flags [P.], cksum 0x923a (incorrect -> 0x425f), seq 179:272, ack 5127, win 302, options [nop,nop,TS val 3522959985 ecr 3656337657], length 93
2019-08-21 09:17:41.202646 IP (tos 0x60, ttl 121, id 11886, offset 0, flags [none], proto TCP (6), length 103)
    123.456.789.74.443 > 123.456.789.112.43442: Flags [P.], cksum 0x349a (correct), seq 5127:5178, ack 272, win 240, options [nop,nop,TS val 3656337662 ecr 3522959985], length 51
2019-08-21 09:17:41.203293 IP (tos 0x0, ttl 64, id 53898, offset 0, flags [DF], proto TCP (6), length 214)
    123.456.789.112.43442 > 123.456.789.74.443: Flags [P.], cksum 0x927f (incorrect -> 0x88c8), seq 272:434, ack 5178, win 302, options [nop,nop,TS val 3522959987 ecr 3656337662], length 162
2019-08-21 09:17:41.236487 IP (tos 0x60, ttl 121, id 11894, offset 0, flags [none], proto TCP (6), length 340)
    123.456.789.74.443 > 123.456.789.112.43442: Flags [P.], cksum 0x2a4a (correct), seq 5178:5466, ack 434, win 244, options [nop,nop,TS val 3656337696 ecr 3522959987], length 288
2019-08-21 09:17:41.236534 IP (tos 0x60, ttl 121, id 11895, offset 0, flags [none], proto TCP (6), length 52)
    123.456.789.74.443 > 123.456.789.112.43442: Flags [F.], cksum 0x2d30 (correct), seq 5466, ack 434, win 244, options [nop,nop,TS val 3656337696 ecr 3522959987], length 0
2019-08-21 09:17:41.236878 IP (tos 0x0, ttl 64, id 53899, offset 0, flags [DF], proto TCP (6), length 83)
    123.456.789.112.43442 > 123.456.789.74.443: Flags [P.], cksum 0x91fc (incorrect -> 0x3dd6), seq 434:465, ack 5467, win 324, options [nop,nop,TS val 3522960020 ecr 3656337696], length 31
2019-08-21 09:17:41.236934 IP (tos 0x0, ttl 64, id 53900, offset 0, flags [DF], proto TCP (6), length 52)
    123.456.789.112.43442 > 123.456.789.74.443: Flags [F.], cksum 0x91dd (incorrect -> 0x2c9f), seq 465, ack 5467, win 324, options [nop,nop,TS val 3522960020 ecr 3656337696], length 0
2019-08-21 09:17:41.237994 IP (tos 0x60, ttl 121, id 11899, offset 0, flags [none], proto TCP (6), length 52)
    123.456.789.74.443 > 123.456.789.112.43442: Flags [.], cksum 0x2ced (correct), seq 5467, ack 466, win 244, options [nop,nop,TS val 3656337698 ecr 3522960020], length 0
2019-08-21 09:17:41.238955 IP (tos 0x0, ttl 64, id 18203, offset 0, flags [DF], proto TCP (6), length 832)
    123.456.789.112.9115 > 123.456.789.86.56168: Flags [P.], cksum 0x1860 (incorrect -> 0x6fac), seq 164698:165478, ack 59067, win 1337, options [nop,nop,TS val 1922799074 ecr 3893299860], length 780
2019-08-21 09:17:41.239007 IP (tos 0x0, ttl 64, id 24174, offset 0, flags [DF], proto TCP (6), length 52)
    123.456.789.86.56168 > 123.456.789.112.9115: Flags [.], cksum 0x1554 (incorrect -> 0x390b), seq 59067, ack 165478, win 1329, options [nop,nop,TS val 3893299909 ecr 1922799074], length 0
2019-08-21 09:17:41.712556 IP (tos 0x0, ttl 64, id 52854, offset 0, flags [DF], proto TCP (6), length 60)
    123.456.789.112.34210 > 123.456.789.12.443: Flags [S], cksum 0x1cf1 (incorrect -> 0x5838), seq 4001060753, win 28400, options [mss 1420,sackOK,TS val 2751787725 ecr 0,nop,wscale 7], length 0
2019-08-21 09:17:42.473167 IP (tos 0x60, ttl 44, id 7212, offset 0, flags [DF], proto TCP (6), length 14132)
    123.456.789.12.443 > 123.456.789.112.34666: Flags [.], cksum 0x53e9 (incorrect -> 0x5abd), seq 5672:19752, ack 430, win 227, options [nop,nop,TS val 1981028639 ecr 2751785339], length 14080
2019-08-21 09:17:42.473216 IP (tos 0x0, ttl 64, id 23634, offset 0, flags [DF], proto TCP (6), length 52)
    123.456.789.112.34666 > 123.456.789.12.443: Flags [.], cksum 0x1ce9 (incorrect -> 0xc808), seq 430, ack 19752, win 530, options [nop,nop,TS val 2751788486 ecr 1981028639], length 0
2019-08-21 09:17:42.485608 IP (tos 0x60, ttl 44, id 7222, offset 0, flags [DF], proto TCP (6), length 6290)
    123.456.789.12.443 > 123.456.789.112.34666: Flags [FP.], cksum 0x3547 (incorrect -> 0x4bcd), seq 19752:25990, ack 430, win 227, options [nop,nop,TS val 1981028642 ecr 2751788486], length 6238
2019-08-21 09:17:42.485641 IP (tos 0x0, ttl 64, id 23635, offset 0, flags [DF], proto TCP (6), length 52)
    123.456.789.112.34666 > 123.456.789.12.443: Flags [.], cksum 0x1ce9 (incorrect -> 0xaf38), seq 430, ack 25991, win 628, options [nop,nop,TS val 2751788498 ecr 1981028642], length 0
2019-08-21 09:17:42.488087 IP (tos 0x0, ttl 64, id 23636, offset 0, flags [DF], proto TCP (6), length 83)
    123.456.789.112.34666 > 123.456.789.12.443: Flags [P.], cksum 0x1d08 (incorrect -> 0x9138), seq 430:461, ack 25991, win 628, options [nop,nop,TS val 2751788501 ecr 1981028642], length 31
2019-08-21 09:17:42.494522 IP (tos 0x0, ttl 64, id 23637, offset 0, flags [DF], proto TCP (6), length 52)
    123.456.789.112.34666 > 123.456.789.12.443: Flags [F.], cksum 0x1ce9 (incorrect -> 0xaf0f), seq 461, ack 25991, win 628, options [nop,nop,TS val 2751788507 ecr 1981028642], length 0
2019-08-21 09:17:42.495595 IP (tos 0x0, ttl 64, id 31355, offset 0, flags [DF], proto TCP (6), length 835)
    123.456.789.112.9115 > 123.456.789.86.56886: Flags [P.], cksum 0x1863 (incorrect -> 0xef01), seq 240044:240827, ack 86038, win 1337, options [nop,nop,TS val 1922800330 ecr 3893297951], length 783
2019-08-21 09:17:42.495653 IP (tos 0x0, ttl 64, id 39410, offset 0, flags [DF], proto TCP (6), length 52)
    123.456.789.86.56886 > 123.456.789.112.9115: Flags [.], cksum 0x1554 (incorrect -> 0x0160), seq 86038, ack 240827, win 1329, options [nop,nop,TS val 3893301165 ecr 1922800330], length 0
2019-08-21 09:17:42.500510 IP (tos 0x60, ttl 44, id 44697, offset 0, flags [DF], proto TCP (6), length 40)
    123.456.789.12.443 > 123.456.789.112.34666: Flags [R], cksum 0x6b83 (correct), seq 784494515, win 0, length 0
2019-08-21 09:17:42.506940 IP (tos 0x60, ttl 44, id 44699, offset 0, flags [DF], proto TCP (6), length 40)
    123.456.789.12.443 > 123.456.789.112.34666: Flags [R], cksum 0x6b83 (correct), seq 784494515, win 0, length 0
2019-08-21 09:17:42.968928 IP (tos 0x0, ttl 64, id 39411, offset 0, flags [DF], proto TCP (6), length 350)
    123.456.789.86.56886 > 123.456.789.112.9115: Flags [P.], cksum 0x167e (incorrect -> 0x9a5e), seq 86038:86336, ack 240827, win 1329, options [nop,nop,TS val 3893301638 ecr 1922800330], length 298
2019-08-21 09:17:42.968955 IP (tos 0x0, ttl 64, id 31356, offset 0, flags [DF], proto TCP (6), length 52)
    123.456.789.112.9115 > 123.456.789.86.56886: Flags [.], cksum 0x1554 (incorrect -> 0xfc7b), seq 240827, ack 86336, win 1337, options [nop,nop,TS val 1922800803 ecr 3893301638], length 0
2019-08-21 09:17:42.970546 IP (tos 0x0, ttl 64, id 33114, offset 0, flags [DF], proto UDP (17), length 62)
    123.456.789.112.33104 > 123.456.789.10.53: [bad udp cksum 0x1521 -> 0x1b7d!] 17010+ AAAA? www........com. (34)
2019-08-21 09:17:42.970927 IP (tos 0x0, ttl 64, id 33115, offset 0, flags [DF], proto UDP (17), length 62)
    123.456.789.112.50533 > 123.456.789.10.53: [bad udp cksum 0x1521 -> 0xcc34!] 19904+ A? www........com. (34)
2019-08-21 09:17:42.971655 IP (tos 0x0, ttl 64, id 32605, offset 0, flags [DF], proto UDP (17), length 189)
    123.456.789.10.53 > 123.456.789.112.33104: [bad udp cksum 0x15a0 -> 0x054f!] 17010 q: AAAA? www........com. 1/1/0 www........com. [2m16s] CNAME server.url.com. ns: name.server.com. [2m16s] SOA dns-external-master.amazon.com. root.amazon.com. 2013120667 28800 900 604800 7207 (161)
2019-08-21 09:17:42.971808 IP (tos 0x0, ttl 64, id 32606, offset 0, flags [DF], proto UDP (17), length 137)
    123.456.789.10.53 > 123.456.789.112.50533: [bad udp cksum 0x156c -> 0x7422!] 19904 q: A? www........com. 2/0/0 www........com. [2m14s] CNAME server.url.com., server.url.com. [1h2m14s] A 123.456.789.12 (109)
2019-08-21 09:17:42.972450 IP (tos 0x0, ttl 64, id 60016, offset 0, flags [DF], proto TCP (6), length 60)
    123.456.789.112.34690 > 123.456.789.12.443: Flags [S], cksum 0x1cf1 (incorrect -> 0xb71f), seq 2407420123, win 28400, options [mss 1420,sackOK,TS val 2751788985 ecr 0,nop,wscale 7], length 0
2019-08-21 09:17:42.983423 IP (tos 0x60, ttl 44, id 0, offset 0, flags [DF], proto TCP (6), length 60)
    123.456.789.12.443 > 123.456.789.112.34690: Flags [S.], cksum 0x658c (correct), seq 4264610182, ack 2407420124, win 26847, options [mss 1460,sackOK,TS val 1981028767 ecr 2751788985,nop,wscale 7], length 0
2019-08-21 09:17:42.983466 IP (tos 0x0, ttl 64, id 60017, offset 0, flags [DF], proto TCP (6), length 52)
    123.456.789.112.34690 > 123.456.789.12.443: Flags [.], cksum 0x1ce9 (incorrect -> 0xfc4e), seq 1, ack 1, win 222, options [nop,nop,TS val 2751788996 ecr 1981028767], length 0
2019-08-21 09:17:42.983810 IP (tos 0x0, ttl 64, id 60018, offset 0, flags [DF], proto TCP (6), length 219)
    123.456.789.112.34690 > 123.456.789.12.443: Flags [P.], cksum 0x1d90 (incorrect -> 0x4e87), seq 1:168, ack 1, win 222, options [nop,nop,TS val 2751788996 ecr 1981028767], length 167
2019-08-21 09:17:42.994530 IP (tos 0x60, ttl 44, id 53285, offset 0, flags [DF], proto TCP (6), length 52)
    123.456.789.12.443 > 123.456.789.112.34690: Flags [.], cksum 0xfba7 (correct), seq 1, ack 168, win 219, options [nop,nop,TS val 1981028770 ecr 2751788996], length 0
2019-08-21 09:17:42.994557 IP (tos 0x60, ttl 44, id 53286, offset 0, flags [DF], proto TCP (6), length 4148)
    123.456.789.12.443 > 123.456.789.112.34690: Flags [P.], cksum 0x2ce9 (incorrect -> 0x3d28), seq 1:4097, ack 168, win 219, options [nop,nop,TS val 1981028770 ecr 2751788996], length 4096
2019-08-21 09:17:42.994581 IP (tos 0x0, ttl 64, id 60019, offset 0, flags [DF], proto TCP (6), length 52)
    123.456.789.112.34690 > 123.456.789.12.443: Flags [.], cksum 0x1ce9 (incorrect -> 0xeb59), seq 168, ack 4097, win 286, options [nop,nop,TS val 2751789007 ecr 1981028770], length 0
2019-08-21 09:17:42.995290 IP (tos 0x60, ttl 44, id 53289, offset 0, flags [DF], proto TCP (6), length 1576)
    123.456.789.12.443 > 123.456.789.112.34690: Flags [P.], cksum 0x22dd (incorrect -> 0xe42c), seq 4097:5621, ack 168, win 219, options [nop,nop,TS val 1981028770 ecr 2751788996], length 1524
2019-08-21 09:17:42.995298 IP (tos 0x0, ttl 64, id 60020, offset 0, flags [DF], proto TCP (6), length 52)
    123.456.789.112.34690 > 123.456.789.12.443: Flags [.], cksum 0x1ce9 (incorrect -> 0xe54c), seq 168, ack 5621, win 310, options [nop,nop,TS val 2751789008 ecr 1981028770], length 0
2019-08-21 09:17:42.997635 IP (tos 0x0, ttl 64, id 60021, offset 0, flags [DF], proto TCP (6), length 145)
    123.456.789.112.34690 > 123.456.789.12.443: Flags [P.], cksum 0x1d46 (incorrect -> 0x0410), seq 168:261, ack 5621, win 310, options [nop,nop,TS val 2751789010 ecr 1981028770], length 93
2019-08-21 09:17:43.008610 IP (tos 0x60, ttl 44, id 53291, offset 0, flags [DF], proto TCP (6), length 103)
    123.456.789.12.443 > 123.456.789.112.34690: Flags [P.], cksum 0x6bd1 (correct), seq 5621:5672, ack 261, win 219, options [nop,nop,TS val 1981028773 ecr 2751789010], length 51
2019-08-21 09:17:43.008991 IP (tos 0x0, ttl 64, id 60022, offset 0, flags [DF], proto TCP (6), length 228)
    123.456.789.112.34690 > 123.456.789.12.443: Flags [P.], cksum 0x1d99 (incorrect -> 0x1523), seq 261:437, ack 5672, win 310, options [nop,nop,TS val 2751789021 ecr 1981028773], length 176
2019-08-21 09:17:43.057291 IP (tos 0x60, ttl 44, id 53292, offset 0, flags [DF], proto TCP (6), length 52)
    123.456.789.12.443 > 123.456.789.112.34690: Flags [.], cksum 0xe442 (correct), seq 5672, ack 437, win 227, options [nop,nop,TS val 1981028786 ecr 2751789021], length 0
2019-08-21 09:17:43.289741 IP (tos 0x60, ttl 44, id 53293, offset 0, flags [DF], proto TCP (6), length 15486)
    123.456.789.12.443 > 123.456.789.112.34690: Flags [FP.], cksum 0x5933 (incorrect -> 0xe0a4), seq 5672:21106, ack 437, win 227, options [nop,nop,TS val 1981028844 ecr 2751789021], length 15434
2019-08-21 09:17:43.289799 IP (tos 0x0, ttl 64, id 60023, offset 0, flags [DF], proto TCP (6), length 52)
    123.456.789.112.34690 > 123.456.789.12.443: Flags [.], cksum 0x1ce9 (incorrect -> 0xa560), seq 437, ack 21107, win 551, options [nop,nop,TS val 2751789302 ecr 1981028844], length 0
2019-08-21 09:17:43.291147 IP (tos 0x0, ttl 64, id 60024, offset 0, flags [DF], proto TCP (6), length 83)
    123.456.789.112.34690 > 123.456.789.12.443: Flags [P.], cksum 0x1d08 (incorrect -> 0x41c3), seq 437:468, ack 21107, win 551, options [nop,nop,TS val 2751789304 ecr 1981028844], length 31
2019-08-21 09:17:43.291675 IP (tos 0x0, ttl 64, id 60025, offset 0, flags [DF], proto TCP (6), length 52)
    123.456.789.112.34690 > 123.456.789.12.443: Flags [F.], cksum 0x1ce9 (incorrect -> 0xa53e), seq 468, ack 21107, win 551, options [nop,nop,TS val 2751789304 ecr 1981028844], length 0
2019-08-21 09:17:43.294452 IP (tos 0x0, ttl 64, id 31357, offset 0, flags [DF], proto TCP (6), length 830)
    123.456.789.112.9115 > 123.456.789.86.56886: Flags [P.], cksum 0x185e (incorrect -> 0xaf5e), seq 240827:241605, ack 86336, win 1337, options [nop,nop,TS val 1922801129 ecr 3893301638], length 778
2019-08-21 09:17:43.294525 IP (tos 0x0, ttl 64, id 39412, offset 0, flags [DF], proto TCP (6), length 52)
    123.456.789.86.56886 > 123.456.789.112.9115: Flags [.], cksum 0x1554 (incorrect -> 0xf6ed), seq 86336, ack 241605, win 1329, options [nop,nop,TS val 3893301964 ecr 1922801129], length 0
2019-08-21 09:17:43.301928 IP (tos 0x60, ttl 44, id 44847, offset 0, flags [DF], proto TCP (6), length 40)
    123.456.789.12.443 > 123.456.789.112.34690: Flags [R], cksum 0xefb5 (correct), seq 4264631289, win 0, length 0
2019-08-21 09:17:43.302501 IP (tos 0x60, ttl 44, id 44848, offset 0, flags [DF], proto TCP (6), length 40)
    123.456.789.12.443 > 123.456.789.112.34690: Flags [R], cksum 0xefb5 (correct), seq 4264631289, win 0, length 0
2019-08-21 09:17:48.736044 IP (tos 0x0, ttl 64, id 312, offset 0, flags [DF], proto TCP (6), length 329)
    123.456.789.85.35972 > 123.456.789.112.9115: Flags [P.], cksum 0x1668 (incorrect -> 0xc48a), seq 92304:92581, ack 258229, win 1329, options [nop,nop,TS val 1870395272 ecr 162304249], length 277
2019-08-21 09:17:48.736080 IP (tos 0x0, ttl 64, id 34656, offset 0, flags [DF], proto TCP (6), length 52)
    123.456.789.112.9115 > 123.456.789.85.35972: Flags [.], cksum 0x1553 (incorrect -> 0x0867), seq 258229, ack 92581, win 1337, options [nop,nop,TS val 162316360 ecr 1870395272], length 0
2019-08-21 09:17:48.737223 IP (tos 0x0, ttl 64, id 33882, offset 0, flags [DF], proto UDP (17), length 68)
    123.456.789.112.48680 > 123.456.789.10.53: [bad udp cksum 0x1527 -> 0x3e70!] 41328+ AAAA? analytics........com. (40)
2019-08-21 09:17:48.737259 IP (tos 0x0, ttl 64, id 33883, offset 0, flags [DF], proto UDP (17), length 68)
    123.456.789.112.55149 > 123.456.789.10.53: [bad udp cksum 0x1527 -> 0x1085!] 46641+ A? analytics........com. (40)
2019-08-21 09:17:48.738355 IP (tos 0x0, ttl 64, id 37042, offset 0, flags [DF], proto UDP (17), length 169)
    123.456.789.10.53 > 123.456.789.112.48680: [bad udp cksum 0x158c -> 0xf81c!] 41328 q: AAAA? analytics........com. 1/1/0 analytics........com. [3m59s] CNAME ........com. ns: .......com. [8m35s] SOA ns.soa.net. awsdns-hostmaster.amazon.com. 1 7200 900 1209600 86400 (141)
2019-08-21 09:17:48.738398 IP (tos 0x0, ttl 64, id 37043, offset 0, flags [DF], proto UDP (17), length 104)
    123.456.789.10.53 > 123.456.789.112.55149: [bad udp cksum 0x154b -> 0xeb18!] 46641 q: A? analytics........com. 2/0/0 analytics........com. [3m59s] CNAME ........com., ........com. [3m59s] A 123.456.789.74 (76)
2019-08-21 09:17:48.738875 IP (tos 0x0, ttl 64, id 54453, offset 0, flags [DF], proto TCP (6), length 60)
    123.456.789.112.43918 > 123.456.789.74.443: Flags [S], cksum 0x91e5 (incorrect -> 0x8a0f), seq 12715399, win 28400, options [mss 1420,sackOK,TS val 3522967522 ecr 0,nop,wscale 7], length 0
2019-08-21 09:17:48.740636 IP (tos 0x60, ttl 121, id 40312, offset 0, flags [none], proto TCP (6), length 60)
    123.456.789.74.443 > 123.456.789.112.43918: Flags [S.], cksum 0x2506 (correct), seq 953701579, ack 12715400, win 60192, options [mss 1380,sackOK,TS val 2032722466 ecr 3522967522,nop,wscale 8], length 0
2019-08-21 09:17:48.740654 IP (tos 0x0, ttl 64, id 54454, offset 0, flags [DF], proto TCP (6), length 52)
    123.456.789.112.43918 > 123.456.789.74.443: Flags [.], cksum 0x91dd (incorrect -> 0x3dc4), seq 1, ack 1, win 222, options [nop,nop,TS val 3522967524 ecr 2032722466], length 0
2019-08-21 09:17:48.740807 IP (tos 0x0, ttl 64, id 54455, offset 0, flags [DF], proto TCP (6), length 225)
    123.456.789.112.43918 > 123.456.789.74.443: Flags [P.], cksum 0x928a (incorrect -> 0x8094), seq 1:174, ack 1, win 222, options [nop,nop,TS val 3522967524 ecr 2032722466], length 173
2019-08-21 09:17:48.741739 IP (tos 0x60, ttl 121, id 40313, offset 0, flags [none], proto TCP (6), length 52)
    123.456.789.74.443 > 123.456.789.112.43918: Flags [.], cksum 0x3d04 (correct), seq 1, ack 174, win 240, options [nop,nop,TS val 2032722467 ecr 3522967524], length 0
2019-08-21 09:17:48.743094 IP (tos 0x60, ttl 121, id 40315, offset 0, flags [none], proto TCP (6), length 5178)
    123.456.789.74.443 > 123.456.789.112.43918: Flags [P.], cksum 0xa5e3 (incorrect -> 0x7402), seq 1:5127, ack 174, win 240, options [nop,nop,TS val 2032722468 ecr 3522967524], length 5126
2019-08-21 09:17:48.743115 IP (tos 0x0, ttl 64, id 54456, offset 0, flags [DF], proto TCP (6), length 52)
    123.456.789.112.43918 > 123.456.789.74.443: Flags [.], cksum 0x91dd (incorrect -> 0x28bd), seq 174, ack 5127, win 302, options [nop,nop,TS val 3522967526 ecr 2032722468], length 0
2019-08-21 09:17:48.744997 IP (tos 0x0, ttl 64, id 54457, offset 0, flags [DF], proto TCP (6), length 145)
    123.456.789.112.43918 > 123.456.789.74.443: Flags [P.], cksum 0x923a (incorrect -> 0x1113), seq 174:267, ack 5127, win 302, options [nop,nop,TS val 3522967528 ecr 2032722468], length 93
2019-08-21 09:17:48.746368 IP (tos 0x60, ttl 121, id 40319, offset 0, flags [none], proto TCP (6), length 103)
    123.456.789.74.443 > 123.456.789.112.43918: Flags [P.], cksum 0xe031 (correct), seq 5127:5178, ack 267, win 240, options [nop,nop,TS val 2032722471 ecr 3522967528], length 51
2019-08-21 09:17:48.746759 IP (tos 0x0, ttl 64, id 54458, offset 0, flags [DF], proto TCP (6), length 213)
    123.456.789.112.43918 > 123.456.789.74.443: Flags [P.], cksum 0x927e (incorrect -> 0xfc83), seq 267:428, ack 5178, win 302, options [nop,nop,TS val 3522967530 ecr 2032722471], length 161
2019-08-21 09:17:48.753326 IP (tos 0x60, ttl 121, id 40326, offset 0, flags [none], proto TCP (6), length 311)
    123.456.789.74.443 > 123.456.789.112.43918: Flags [P.], cksum 0x4c45 (correct), seq 5178:5437, ack 428, win 244, options [nop,nop,TS val 2032722479 ecr 3522967530], length 259
2019-08-21 09:17:48.753429 IP (tos 0x60, ttl 121, id 40327, offset 0, flags [none], proto TCP (6), length 52)
    123.456.789.74.443 > 123.456.789.112.43918: Flags [F.], cksum 0x26b3 (correct), seq 5437, ack 428, win 244, options [nop,nop,TS val 2032722479 ecr 3522967530], length 0
2019-08-21 09:17:48.753801 IP (tos 0x0, ttl 64, id 54459, offset 0, flags [DF], proto TCP (6), length 83)
    123.456.789.112.43918 > 123.456.789.74.443: Flags [P.], cksum 0x91fc (incorrect -> 0x2cae), seq 428:459, ack 5438, win 324, options [nop,nop,TS val 3522967537 ecr 2032722479], length 31
2019-08-21 09:17:48.753895 IP (tos 0x0, ttl 64, id 54460, offset 0, flags [DF], proto TCP (6), length 52)
    123.456.789.112.43918 > 123.456.789.74.443: Flags [F.], cksum 0x91dd (incorrect -> 0x263c), seq 459, ack 5438, win 324, options [nop,nop,TS val 3522967537 ecr 2032722479], length 0
2019-08-21 09:17:48.754980 IP (tos 0x60, ttl 121, id 40328, offset 0, flags [none], proto TCP (6), length 52)
    123.456.789.74.443 > 123.456.789.112.43918: Flags [.], cksum 0x268b (correct), seq 5438, ack 460, win 244, options [nop,nop,TS val 2032722480 ecr 3522967537], length 0
2019-08-21 09:17:48.755133 IP (tos 0x0, ttl 64, id 34657, offset 0, flags [DF], proto TCP (6), length 827)
    123.456.789.112.9115 > 123.456.789.85.35972: Flags [P.], cksum 0x185a (incorrect -> 0x0900), seq 258229:259004, ack 92581, win 1337, options [nop,nop,TS val 162316379 ecr 1870395272], length 775
2019-08-21 09:17:48.755210 IP (tos 0x0, ttl 64, id 313, offset 0, flags [DF], proto TCP (6), length 52)
    123.456.789.85.35972 > 123.456.789.112.9115: Flags [.], cksum 0x1553 (incorrect -> 0x0542), seq 92581, ack 259004, win 1329, options [nop,nop,TS val 1870395291 ecr 162316379], length 0
2019-08-21 09:17:49.968529 IP (tos 0x0, ttl 64, id 52855, offset 0, flags [DF], proto TCP (6), length 60)
    123.456.789.112.34210 > 123.456.789.12.443: Flags [S], cksum 0x1cf1 (incorrect -> 0x37f9), seq 4001060753, win 28400, options [mss 1420,sackOK,TS val 2751795980 ecr 0,nop,wscale 7], length 0
2019-08-21 09:17:54.064536 ARP, Ethernet (len 6), IPv4 (len 4), Request who-has 123.456.789.112 tell 123.456.789.25, length 28
2019-08-21 09:17:54.064549 ARP, Ethernet (len 6), IPv4 (len 4), Reply 123.456.789.112 is-at aa:f0:b8:4b:80:56, length 28
2019-08-21 09:17:54.083781 IP (tos 0x0, ttl 64, id 63694, offset 0, flags [DF], proto TCP (6), length 738)
    123.456.789.112.9115 > 123.456.789.85.39968: Flags [P.], cksum 0x1801 (incorrect -> 0x6ef1), seq 144887:145573, ack 51681, win 1337, options [nop,nop,TS val 162321707 ecr 1870381113], length 686
2019-08-21 09:17:54.083864 IP (tos 0x0, ttl 64, id 44458, offset 0, flags [DF], proto TCP (6), length 52)
    123.456.789.85.39968 > 123.456.789.112.9115: Flags [.], cksum 0x1553 (incorrect -> 0x9cc4), seq 51681, ack 145573, win 1329, options [nop,nop,TS val 1870400619 ecr 162321707], length 0
```

**Comment by brian-brazil** [comment]
So it looks like this issue is on your end. The remote side is sending a RST after negotiation, and then the blackbox exporter reattempts the connection to the same effect a few times.

**Comment by starcry** [comment]
understood, I think I might have it solved now, thank you, I'll close it out

**Comment by armorsun** [comment]
@starcry Could you please explain how did you solve this problem? I met the same problem.
