### ISSUE TITLE
ICMP probe fails to recover after 1hr outage, recovers immediately on exporter restart

### ISSUE THREAD

**Issue by danpoltawski** [prometheus/blackbox_exporter#705]
We have been getting a reoccurring problem where icmp probes fail to recover after an outage of an hour or so, when we restart the exporter the probe immediately recovers. In the meantime other icmp probes (and other blackbox probes (tcp/http)) continue to work fine and recover fine so it seems to be a peculiarity of icmp.

I have been trying to establish a simple reproducible testcase for this by firewalling off icmp on a simple probe for an hour and things recover as expected. I've also repeating the same number of probes as we have in production and this works fine. So I think this is some peculiarity of our setup is triggering this bug. 

**Of note:** The nodes we are probing where i've noticed this problem are at the other end of VPN and when they fail the intermediary router would fail - so I wonder if it's something icmp'y from the intermediary router which is causing this problem.

### Host operating system: 
Linux 4.19.0-12-amd64 #1 SMP Debian 4.19.152-1 (2020-10-18) x86_64 GNU/Linux

### blackbox_exporter version: 
```
blackbox_exporter, version 0.17.0 (branch: HEAD, revision: 1bc768014cf6815f7e9d694e0292e77dd10f3235)
  build user:       root@626fb3899f41
  build date:       20200619-11:54:41
  go version:       go1.14.4
```

### What is the blackbox.yml module config.
```
---
modules:
  icmp4:
    prober: icmp
    icmp:
      preferred_ip_protocol: ip4
```
### What is the prometheus.yml scrape config.
```
- job_name: icmp4
  scrape_interval: 30s
  metrics_path: /probe
  params:
    module:
      - icmp4
  file_sd_configs:
    - files:
      - /etc/prometheus-hosts/internal/blackbox-icmp4.yaml
      - /etc/prometheus-hosts/external/blackbox-icmp4.yaml
  relabel_configs:
    - source_labels: [__address__]
      target_label: __param_target
    - source_labels: [__param_target]
      target_label: instance
    - target_label: __address__
      replacement: 127.0.0.1:9115  # The blackbox exporter's real hostname:port.
```
### What logging output did you get from adding `&debug=true` to the probe URL?

I'm afraid I don't have this output, but I will strive to get it next time I encounter this failure

### What did you do that produced an error?

No error - incorrect `probe_success` value

### What did you expect to see?

probe_success = 1
### What did you see instead?
probe_success = 0

**Comment by danpoltawski** [comment]
Just tried to replicate this our production environment with a host we have had problems with by firewalling that host icmp packets. Again this worked fine. So seems very likely the cause is related to the intermediary hops. Wondering if someone with more familiarity with the code would be able to help me establish steps to reproduce.

**Comment by brian-brazil** [comment]
This has come up before in #360. If you can produce a tcpdump indicating that the blackbox exporter is at fault then I can debug further, otherwise it's likey a network issue on your end that is being correctly detected.

**Comment by danpoltawski** [comment]
Thanks - I had not seen that issue. Next time this comes up I'll report back and close this issue if required.

**Comment by danpoltawski** [comment]
(There are firewalls in between so some weird connection tracking issue sounds plausible)

**Comment by danpoltawski** [comment]
Thanks, this happened again and can confirm this appears to be something broken with intermediary firewall with no responses coming back:

```
poltawski@metrics:~$ sudo tcpdump -nn host 172.30.6.3 and icmp
tcpdump: verbose output suppressed, use -v or -vv for full protocol decode
listening on ens18, link-type EN10MB (Ethernet), capture size 262144 bytes
08:38:45.660505 IP 10.64.131.46 > 172.30.6.3: ICMP echo request, id 16466, seq 30797, length 36
08:39:15.660857 IP 10.64.131.46 > 172.30.6.3: ICMP echo request, id 16466, seq 30925, length 36
08:39:45.660694 IP 10.64.131.46 > 172.30.6.3: ICMP echo request, id 16466, seq 31053, length 36
08:40:15.660437 IP 10.64.131.46 > 172.30.6.3: ICMP echo request, id 16466, seq 31181, length 36
```

Closing.

**Comment by danpoltawski** [comment]
Just reopening this for another point for discussion after discussing this internally - is there any scope for an option which restarts the icmp sequence? This didn't affect us with nagios and other monitoring tools because a new ping was started each poll. And you can see this working here when I do a manual ping from the host while the blackbox exporter is still failing:

```
08:48:15.659721 IP 10.64.131.46 > 172.30.6.3: ICMP echo request, id 16466, seq 33229, length 36
08:48:28.828265 IP 10.64.131.46 > 172.30.6.3: ICMP echo request, id 2789, seq 1, length 64
08:48:28.830281 IP 172.30.6.3 > 10.64.131.46: ICMP echo reply, id 2789, seq 1, length 64
08:48:29.828306 IP 10.64.131.46 > 172.30.6.3: ICMP echo request, id 2789, seq 2, length 64
08:48:29.830452 IP 172.30.6.3 > 10.64.131.46: ICMP echo reply, id 2789, seq 2, length 64
08:48:45.660874 IP 10.64.131.46 > 172.30.6.3: ICMP echo request, id 16466, seq 33357, length 36
08:49:15.660606 IP 10.64.131.46 > 172.30.6.3: ICMP echo request, id 16466, seq 33485, length 36
```

It's not ideal that we need to restart the blackbox exporter to deal with this scenario

**Comment by brian-brazil** [comment]
I don't see why we would add that, it'd make collisions possible and it is correctly detecting a problem with your network.

**Comment by danpoltawski** [comment]
I'm not sure it'd make collisions possible if a new session was created established?

The rationale is that I've no way of determining between an obscure long-lived session tracking issue and a node being completely down from a network POV with the exporter. I agree this is detecting a problem with the network, but it's somewhat of an edge case and not as important to me as 'can I ping it?' which I can't answer with the exporter.

**Comment by brian-brazil** [comment]
There's no such thing as a session in ICMP, it is completely stateless. We do however need to ensure that probes of the same address close to each other time wise have unique sequence numbers. We do this in the simple way, a global counter. Thus there is already a new sequence number each poll.

If you want to test that a particular network application works because ICMP is broken, you can use a non-ICMP probe.

**Comment by danpoltawski** [comment]
> There's no such thing as a session in ICMP, it is completely stateless. 

Thanks - looking at the above tcpdump output, I guess the 'broken firewall' is doing something by tracking state using the ip id field. 

> If you want to test that a particular network application works because ICMP is broken, you can use a non-ICMP probe.

Indeed, and we do - but I'd hoped we'd be able to setup Inhibition based on an icmp probe (matching existing nagios approach).

**Comment by weakcamel** [comment]
> I don't see why we would add that, it'd make collisions possible and it is correctly detecting a problem with your network.

While it's a good thing that the probe detects the problem, it just doesn't seem to ever recover again, even if the. Surely a false negative forever isn't desirable either?

```
myuser@hostname:~$ date
Wed Feb 12 15:42:57 GMT 2025

myuser@hostname:~$ ping -c3 172.19.0.1
PING 172.19.0.1 (172.19.0.1) 56(84) bytes of data.
64 bytes from 172.19.0.1: icmp_seq=1 ttl=252 time=3.25 ms
64 bytes from 172.19.0.1: icmp_seq=2 ttl=252 time=3.15 ms
64 bytes from 172.19.0.1: icmp_seq=3 ttl=252 time=3.71 ms

--- 172.19.0.1 ping statistics ---
3 packets transmitted, 3 received, 0% packet loss, time 2002ms
rtt min/avg/max/mdev = 3.155/3.373/3.715/0.249 ms

myuser@hostname:~$ curl -sSfL "http://localhost:9115/probe?module=icmp_connect&target=172.19.0.1" | grep probe_success
# HELP probe_success Displays whether or not the probe was a success
# TYPE probe_success gauge
probe_success 0

myuser@hostname:~$ date
Wed Feb 12 15:43:22 GMT 2025
```

**Comment by weakcamel** [comment]
Thank you so much @dgl for the clarification, that made it click for me at last ! :)

As for the unprivileged listen, the process  does have `CAP_NET_RAW` capability assigned so I'm guessing it's this method which lets blackbox-exporter work but emit that debug message? I did try setting `net.ipv4.ping_group_range` as well and that cleared it.

```
root@myhost:~# getcap /usr/local/bin/blackbox_exporter
/usr/local/bin/blackbox_exporter = cap_net_raw+ep
root@myhost:~# getpcaps $(pgrep -f blackbox_exporter)
Capabilities for `26287': = cap_net_raw+eip
```
