### ISSUE TITLE
Keepalive regression?

### ISSUE THREAD

**Issue by acdha** [prometheus/blackbox_exporter#432]
### Host operating system: output of `uname -a`

Linux 2.6.32-754.10.1.el6.x86_64 #1 SMP Thu Nov 29 15:44:01 EST 2018 x86_64 x86_64 x86_64 GNU/Linux

### blackbox_exporter version: output of `blackbox_exporter -version`
```
blackbox_exporter, version 0.13.0 (branch: HEAD, revision: 1cfb7512daa7e100abb32037996c8f805990d813)
  build user:       root@7b171fc53a0a
  build date:       20181204-15:06:48
  go version:       go1.11.2
```

### What is the blackbox.yml module config.
```yaml
modules:
    http_2xx:
        prober: http
        timeout: 15s
        http:
            preferred_ip_protocol: "ip4"
```

### What is the prometheus.yml scrape config.
n/a
### What logging output did you get from adding `&debug=true` to the probe URL?
```
ts=2019-03-11T14:13:25.27606905Z caller=utils.go:52 module=http_2xx target=… level=warn msg="Resolution with preferred IP protocol failed, attempting fallback protocol" fallback_protocol=ip6 err="lookup … on …:53: dial udp …:53: socket: too many open files"
ts=2019-03-11T14:13:25.276294237Z caller=http.go:208 module=http_2xx target=… level=error msg="Error resolving address" err="lookup … on …:53: dial udp …:53: socket: too many open files"
ts=2019-03-11T14:13:25.276306808Z caller=main.go:131 module=http_2xx target=… level=error msg="Probe failed" duration_seconds=0.000575222
```

### What did you see instead?

Our monitoring was showing some probe failures for services which were up and a quick curl check showed there were no reachability issues from the blackbox host. A quick `sudo lsof -p $(pgrep blackbox_) -a -i` showed that ~1019 sockets were open for 3 servers which were in a hung state accepting connections but never responding, which is just below the ulimit 1024 (subsequently raised). This surprised me since the probes always completed and I “knew” that keep-alive support had been disabled a long time ago in https://github.com/prometheus/blackbox_exporter/commit/78897d2b92f66d50f0c17731baf5a42e7d1b4a0d but if I'm reading https://github.com/prometheus/blackbox_exporter/commit/42084122e9d631acf9cdca0033e6c7d19b3fe1c8 and https://github.com/prometheus/common/pull/129 correctly this was silently reverted in some work related to authentication settings when the client configuration was refactored to use the common config module, which changed DisableKeepAlives from true to false.

**Comment by brian-brazil** [comment]
We haven't pulled in that change to common yet for that reason, so the question is more why aren't these timing out.

**Comment by acdha** [comment]
Very good question — I didn't get the socket timing out of lsof (sample line below) before restarting it. The probes completed very quickly — a colleague noticed this due to the suspiciously-low `probe_duration_seconds` — and a TCP-level timeout wouldn't help since the remote server is still handling networking just fine even if the app has hung and `ss --options` shows no timers in any case.

```
blackbox_ 1126 prometheus 1004u  IPv4 374024431      0t0       TCP monitor:57892->dead-server:9874 (ESTABLISHED)```

It looks like the sockets may eventually time out but it's at a fairly long time-interval: at least tens of minutes. I'm running a test now to try to narrow it down.

**Comment by acdha** [comment]
There's no timeout within at least two hours. 

One oddity: I ran a quick test using blackhole.webpagetest.org and get different results. Here's what I get from a debug probe of the real server:

```
$ curl -v 'http://localhost:9115/probe?target=https://hung.example.com:9874&module=https_insecure&debug=true'
* About to connect() to localhost port 9115 (#0)
*   Trying 127.0.0.1... connected
* Connected to localhost (127.0.0.1) port 9115 (#0)
> GET /probe?target=https://ctsvlp21.loc.gov:9874&module=https_insecure&debug=true HTTP/1.1
> User-Agent: curl/7.19.7 (x86_64-redhat-linux-gnu) libcurl/7.19.7 NSS/3.27.1 zlib/1.2.3 libidn/1.18 libssh2/1.4.2
> Host: localhost:9115
> Accept: */*
> 
< HTTP/1.1 200 OK
< Content-Type: text/plain
< Date: Mon, 11 Mar 2019 18:08:10 GMT
< Transfer-Encoding: chunked
< 
Logs for the probe:

ts=2019-03-11T18:08:01.432476194Z caller=main.go:118 module=https_insecure target=https://hung.example.com:9874 level=info msg="Beginning probe" probe=http timeout_seconds=9.5
ts=2019-03-11T18:08:01.432561299Z caller=utils.go:42 module=https_insecure target=https://hung.example.com:9874 level=info msg="Resolving target address" preferred_ip_protocol=ip4
ts=2019-03-11T18:08:01.433203446Z caller=utils.go:65 module=https_insecure target=https://hung.example.com:9874 level=info msg="Resolved target address" ip=192.168.100.55
ts=2019-03-11T18:08:01.433238328Z caller=http.go:281 module=https_insecure target=https://hung.example.com:9874 level=info msg="Making HTTP request" url=https://192.168.100.55:9874 host=hung.example.com:9874
ts=2019-03-11T18:08:10.932617821Z caller=http.go:296 module=https_insecure target=https://hung.example.com:9874 level=error msg="Error for HTTP request" err="Get https://192.168.100.55:9874: context deadline exceeded"
ts=2019-03-11T18:08:10.932675288Z caller=http.go:367 module=https_insecure target=https://hung.example.com:9874 level=info msg="Response timings for roundtrip" roundtrip=0 start=2019-03-11T14:08:01.433309849-04:00 dnsDone=2019-03-11T14:08:01.433309849-04:00 connectDone=2019-03-11T14:08:02.885193269-04:00 gotConn=0001-01-01T00:00:00Z responseStart=0001-01-01T00:00:00Z end=0001-01-01T00:00:00Z
ts=2019-03-11T18:08:10.932700056Z caller=http.go:416 module=https_insecure target=https://hung.example.com:9874 level=error msg="Final request was not over SSL"
ts=2019-03-11T18:08:10.932714009Z caller=main.go:131 module=https_insecure target=https://hung.example.com:9874 level=error msg="Probe failed" duration_seconds=9.500203948
```

Here's the same configuration probing the blackhole server:

```
$ curl -v 'http://localhost:9115/probe?target=https://blackhole.webpagetest.org&module=https_insecure&debug=true'
* About to connect() to localhost port 9115 (#0)
*   Trying 127.0.0.1... connected
* Connected to localhost (127.0.0.1) port 9115 (#0)
> GET /probe?target=https://blackhole.webpagetest.org&module=https_insecure&debug=true HTTP/1.1
> User-Agent: curl/7.19.7 (x86_64-redhat-linux-gnu) libcurl/7.19.7 NSS/3.27.1 zlib/1.2.3 libidn/1.18 libssh2/1.4.2
> Host: localhost:9115
> Accept: */*
> 
< HTTP/1.1 200 OK
< Content-Type: text/plain
< Date: Mon, 11 Mar 2019 18:09:19 GMT
< Transfer-Encoding: chunked
< 
Logs for the probe:
ts=2019-03-11T18:09:10.167106414Z caller=main.go:118 module=https_insecure target=https://blackhole.webpagetest.org level=info msg="Beginning probe" probe=http timeout_seconds=9.5
ts=2019-03-11T18:09:10.167195028Z caller=utils.go:42 module=https_insecure target=https://blackhole.webpagetest.org level=info msg="Resolving target address" preferred_ip_protocol=ip4
ts=2019-03-11T18:09:10.348996325Z caller=utils.go:65 module=https_insecure target=https://blackhole.webpagetest.org level=info msg="Resolved target address" ip=71.114.67.58
ts=2019-03-11T18:09:10.349068461Z caller=http.go:281 module=https_insecure target=https://blackhole.webpagetest.org level=info msg="Making HTTP request" url=https://[71.114.67.58] host=blackhole.webpagetest.org
ts=2019-03-11T18:09:19.667207764Z caller=http.go:296 module=https_insecure target=https://blackhole.webpagetest.org level=error msg="Error for HTTP request" err="Get https://[71.114.67.58]: context deadline exceeded"
ts=2019-03-11T18:09:19.667249512Z caller=http.go:367 module=https_insecure target=https://blackhole.webpagetest.org level=info msg="Response timings for roundtrip" roundtrip=0 start=2019-03-11T14:09:10.349154476-04:00 dnsDone=2019-03-11T14:09:10.349154476-04:00 connectDone=2019-03-11T14:09:19.667215512-04:00 gotConn=0001-01-01T00:00:00Z responseStart=0001-01-01T00:00:00Z end=0001-01-01T00:00:00Z
ts=2019-03-11T18:09:19.667277323Z caller=http.go:416 module=https_insecure target=https://blackhole.webpagetest.org level=error msg="Final request was not over SSL"
ts=2019-03-11T18:09:19.667290965Z caller=main.go:131 module=https_insecure target=https://blackhole.webpagetest.org level=error msg="Probe failed" duration_seconds=9.500150276
```

The difference is that `ss dst blackhole.webpagetest.org` will show no sockets being left behind but the established socket for the internal server does linger. I was wondering whether that was something like the underlying TLS layer because the hung server successfully does the socket handshake before hanging (it does not respond to the initial TLS session request).

**Comment by brian-brazil** [comment]
That smells like a bug down in Go with TLS. We've had hints of such a thing for years, but never got to the bottom of it.

Can you get a `tcpdump` from both sides?

**Comment by acdha** [comment]
Sure. Moderately redacted, it looks like this:

```
reading from file hung-tls-connection.tcpdump, link-type EN10MB (Ethernet)
14:54:15.269217 IP (tos 0x0, ttl 64, id 23632, offset 0, flags [DF], proto TCP (6), length 60)
    192.168.104.61.41706 > 192.168.100.55.9874: Flags [S], cksum 0x0e99 (correct), seq 4010843580, win 14600, options [mss 1460,sackOK,TS val 42844652 ecr 0,nop,wscale 7], length 0
14:54:15.299897 IP (tos 0x0, ttl 63, id 0, offset 0, flags [DF], proto TCP (6), length 60)
    192.168.100.55.9874 > 192.168.104.61.41706: Flags [S.], cksum 0xaf1d (correct), seq 103970431, ack 4010843581, win 14480, options [mss 1460,sackOK,TS val 42721445 ecr 42844652,nop,wscale 7], length 0
14:54:15.299919 IP (tos 0x0, ttl 64, id 23633, offset 0, flags [DF], proto TCP (6), length 52)
    192.168.104.61.41706 > 192.168.100.55.9874: Flags [.], cksum 0x15e9 (correct), seq 1, ack 1, win 115, options [nop,nop,TS val 42844682 ecr 42721445], length 0
14:54:15.300013 IP (tos 0x0, ttl 64, id 23634, offset 0, flags [DF], proto TCP (6), length 219)
    192.168.104.61.41706 > 192.168.100.55.9874: Flags [P.], cksum 0xe668 (incorrect -> 0x012e), seq 1:168, ack 1, win 115, options [nop,nop,TS val 42844682 ecr 42721445], length 167
14:54:15.300167 IP (tos 0x0, ttl 63, id 38437, offset 0, flags [DF], proto TCP (6), length 52)
    192.168.100.55.9874 > 192.168.104.61.41706: Flags [.], cksum 0x153b (correct), seq 1, ack 168, win 122, options [nop,nop,TS val 42721445 ecr 42844682], length 0
14:54:24.634189 IP (tos 0x0, ttl 64, id 20055, offset 0, flags [DF], proto TCP (6), length 60)
    192.168.104.61.42134 > 192.168.100.55.9874: Flags [S], cksum 0x5545 (correct), seq 1997121750, win 14600, options [mss 1460,sackOK,TS val 42854017 ecr 0,nop,wscale 7], length 0
14:54:24.871050 IP (tos 0x0, ttl 63, id 0, offset 0, flags [DF], proto TCP (6), length 60)
    192.168.100.55.9874 > 192.168.104.61.42134: Flags [S.], cksum 0xf84e (correct), seq 4253374275, ack 1997121751, win 14480, options [mss 1460,sackOK,TS val 42731016 ecr 42854017,nop,wscale 7], length 0
14:54:24.871061 IP (tos 0x0, ttl 64, id 20056, offset 0, flags [DF], proto TCP (6), length 52)
    192.168.104.61.42134 > 192.168.100.55.9874: Flags [.], cksum 0x5e4b (correct), seq 1, ack 1, win 115, options [nop,nop,TS val 42854254 ecr 42731016], length 0
14:54:24.871149 IP (tos 0x0, ttl 64, id 20057, offset 0, flags [DF], proto TCP (6), length 219)
    192.168.104.61.42134 > 192.168.100.55.9874: Flags [P.], cksum 0xe668 (incorrect -> 0xa3ba), seq 1:168, ack 1, win 115, options [nop,nop,TS val 42854254 ecr 42731016], length 167
14:54:24.871289 IP (tos 0x0, ttl 63, id 20812, offset 0, flags [DF], proto TCP (6), length 52)
    192.168.100.55.9874 > 192.168.104.61.42134: Flags [.], cksum 0x5d9d (correct), seq 1, ack 168, win 122, options [nop,nop,TS val 42731016 ecr 42854254], length 0
```

**Comment by acdha** [comment]
The corresponding blackhole.webpagetest.org trace isn't interesting since it's 4 SYNs before it errors out since that service intentionally never replies.

**Comment by brian-brazil** [comment]
That tcpdump looks normal, though it smells like a listen overflow. Does node_netstat_TcpExt_ListenOverflows correlate on the target machine? If so setting /proc/sys/net/ipv4/tcp_abort_on_overflow to 1 will help (and I'd recommend doing that on all your fleet).

There's also indications of a lack of a timeout there, when is a FIN sent?

**Comment by acdha** [comment]
Hmmm, I don't see `node_netstat_TcpExt_ListenOverflows` above zero on any of the three affected target systems.

**Comment by brian-brazil** [comment]
That's what it was last time I saw something like this, this must be different. Can you get a tcpdump from the other side?

**Comment by brian-brazil** [comment]
We're on the new library now. Are you seeing this still with the latest version?

**Comment by acdha** [comment]
Let me test — we were just updated our RPMs

**Comment by acdha** [comment]
This appears to still be an issue:

```
blackbox_exporter, version 0.14.0 (branch: HEAD, revision: bba7ef76193948a333a5868a1ab38b864f7d968a)
  build user:       root@63d11aa5b6c6
  build date:       20190315-13:32:31
  go version:       go1.11.5
```

```
$ curl -s --fail 'http://localhost:9115/probe?target=https://venerablejavaapp.example.org:9874&module=https_insecure&debug=true'
Logs for the probe:
ts=2019-08-08T15:11:26.491006594Z caller=main.go:118 module=https_insecure target=https://venerablejavaapp.example.org:9874 level=info msg="Beginning probe" probe=http timeout_seconds=9.5
ts=2019-08-08T15:11:26.491090395Z caller=utils.go:42 module=https_insecure target=https://venerablejavaapp.example.org:9874 level=info msg="Resolving target address" ip_protocol=ip4
ts=2019-08-08T15:11:26.492031129Z caller=utils.go:75 module=https_insecure target=https://venerablejavaapp.example.org:9874 level=info msg="Resolved target address" ip=192.168.204.230
ts=2019-08-08T15:11:26.492064963Z caller=http.go:349 module=https_insecure target=https://venerablejavaapp.example.org:9874 level=info msg="Making HTTP request" url=https://192.168.204.230:9874 host=venerablejavaapp.example.org:9874
ts=2019-08-08T15:11:35.991096264Z caller=http.go:364 module=https_insecure target=https://venerablejavaapp.example.org:9874 level=error msg="Error for HTTP request" err="Get https://192.168.204.230:9874: context deadline exceeded"
ts=2019-08-08T15:11:35.991149312Z caller=http.go:450 module=https_insecure target=https://venerablejavaapp.example.org:9874 level=info msg="Response timings for roundtrip" roundtrip=0 start=2019-08-08T11:11:26.492104867-04:00 dnsDone=2019-08-08T11:11:26.492104867-04:00 connectDone=2019-08-08T11:11:26.494174226-04:00 gotConn=0001-01-01T00:00:00Z responseStart=0001-01-01T00:00:00Z end=0001-01-01T00:00:00Z
ts=2019-08-08T15:11:35.99117191Z caller=http.go:499 module=https_insecure target=https://venerablejavaapp.example.org:9874 level=error msg="Final request was not over SSL"
ts=2019-08-08T15:11:35.991183514Z caller=main.go:131 module=https_insecure target=https://venerablejavaapp.example.org:9874 level=error msg="Probe failed" duration_seconds=9.500142937
```

Each time that runs, it leaks a connection which stays open for hours. This no longer causes outages because our server has cron restarting it every hour but they build up until then:
```
$ sudo lsof -p $(pgrep blackbox_) -a -i :9874 
COMMAND     PID       USER   FD   TYPE DEVICE SIZE/OFF NODE NAME
blackbox_ 17899 prometheus    7u  IPv4 369664      0t0  TCP prometheus.example.org:59222->venerablejavaapp.example.org:9874 (ESTABLISHED)
blackbox_ 17899 prometheus    6u  IPv4 371216      0t0  TCP prometheus.example.org:59888->venerablejavaapp.example.org:9874 (ESTABLISHED)
blackbox_ 17899 prometheus    8u  IPv4 377682      0t0  TCP prometheus.example.org:33956->venerablejavaapp.example.org:9874 (ESTABLISHED)
blackbox_ 17899 prometheus   12u  IPv4 375333      0t0  TCP prometheus.example.org:32942->venerablejavaapp.example.org:9874 (ESTABLISHED)
```

**Comment by brian-brazil** [comment]
That change hasn't been put in a release yet, could you try master?

**Comment by brian-brazil** [comment]
This is probably the same as #513
